game_id,game_date,home_team,away_team,location,date,hour,game_string,away_score,home_score
401704971,25/12/2024,New York Knicks,San Antonio Spurs,Madison Square Garden,25/12/2024,17:00 UTC,"San Antonio Spurs vs New York Knicks @ Madison Square Garden, 2024-12-25 17:00 UTC",114.0,117.0
401704972,25/12/2024,Dallas Mavericks,Minnesota Timberwolves,American Airlines Center,25/12/2024,19:30 UTC,"Minnesota Timberwolves vs Dallas Mavericks @ American Airlines Center, 2024-12-25 19:30 UTC",105.0,99.0
401704973,25/12/2024,Boston Celtics,Philadelphia 76ers,TD Garden,25/12/2024,22:00 UTC,"Philadelphia 76ers vs Boston Celtics @ TD Garden, 2024-12-25 22:00 UTC",118.0,114.0
401704974,26/12/2024,Golden State Warriors,Los Angeles Lakers,Chase Center,26/12/2024,01:00 UTC,"Los Angeles Lakers vs Golden State Warriors @ Chase Center, 2024-12-26 01:00 UTC",115.0,113.0
401704975,26/12/2024,Phoenix Suns,Denver Nuggets,PHX Arena,26/12/2024,03:30 UTC,"Denver Nuggets vs Phoenix Suns @ PHX Arena, 2024-12-26 03:30 UTC",100.0,110.0
401704976,27/12/2024,Indiana Pacers,Oklahoma City Thunder,Gainbridge Fieldhouse,27/12/2024,00:00 UTC,"Oklahoma City Thunder vs Indiana Pacers @ Gainbridge Fieldhouse, 2024-12-27 00:00 UTC",120.0,114.0
401704977,27/12/2024,Orlando Magic,Miami Heat,Kia Center,27/12/2024,00:00 UTC,"Miami Heat vs Orlando Magic @ Kia Center, 2024-12-27 00:00 UTC",89.0,88.0
401704978,27/12/2024,Washington Wizards,Charlotte Hornets,Capital One Arena,27/12/2024,00:00 UTC,"Charlotte Hornets vs Washington Wizards @ Capital One Arena, 2024-12-27 00:00 UTC",110.0,113.0
401704979,27/12/2024,Atlanta Hawks,Chicago Bulls,State Farm Arena,27/12/2024,00:30 UTC,"Chicago Bulls vs Atlanta Hawks @ State Farm Arena, 2024-12-27 00:30 UTC",133.0,141.0
401704980,27/12/2024,Memphis Grizzlies,Toronto Raptors,FedExForum,27/12/2024,01:00 UTC,"Toronto Raptors vs Memphis Grizzlies @ FedExForum, 2024-12-27 01:00 UTC",126.0,155.0
401704981,27/12/2024,Milwaukee Bucks,Brooklyn Nets,Fiserv Forum,27/12/2024,01:00 UTC,"Brooklyn Nets vs Milwaukee Bucks @ Fiserv Forum, 2024-12-27 01:00 UTC",111.0,105.0
401704982,27/12/2024,New Orleans Pelicans,Houston Rockets,Smoothie King Center,27/12/2024,01:00 UTC,"Houston Rockets vs New Orleans Pelicans @ Smoothie King Center, 2024-12-27 01:00 UTC",128.0,111.0
401704983,27/12/2024,Portland Trail Blazers,Utah Jazz,Moda Center,27/12/2024,03:00 UTC,"Utah Jazz vs Portland Trail Blazers @ Moda Center, 2024-12-27 03:00 UTC",120.0,122.0
401704984,27/12/2024,Sacramento Kings,Detroit Pistons,Golden 1 Center,27/12/2024,03:00 UTC,"Detroit Pistons vs Sacramento Kings @ Golden 1 Center, 2024-12-27 03:00 UTC",114.0,113.0
401704985,28/12/2024,Orlando Magic,New York Knicks,Kia Center,28/12/2024,00:00 UTC,"New York Knicks vs Orlando Magic @ Kia Center, 2024-12-28 00:00 UTC",108.0,85.0
401704986,28/12/2024,Boston Celtics,Indiana Pacers,TD Garden,28/12/2024,00:30 UTC,"Indiana Pacers vs Boston Celtics @ TD Garden, 2024-12-28 00:30 UTC",105.0,142.0
401704987,28/12/2024,Brooklyn Nets,San Antonio Spurs,Barclays Center,28/12/2024,00:30 UTC,"San Antonio Spurs vs Brooklyn Nets @ Barclays Center, 2024-12-28 00:30 UTC",96.0,87.0
401704988,28/12/2024,Houston Rockets,Minnesota Timberwolves,Toyota Center (Houston),28/12/2024,01:00 UTC,"Minnesota Timberwolves vs Houston Rockets @ Toyota Center (Houston), 2024-12-28 01:00 UTC",113.0,112.0
401704989,28/12/2024,New Orleans Pelicans,Memphis Grizzlies,Smoothie King Center,28/12/2024,01:00 UTC,"Memphis Grizzlies vs New Orleans Pelicans @ Smoothie King Center, 2024-12-28 01:00 UTC",132.0,124.0
401704990,28/12/2024,Denver Nuggets,Cleveland Cavaliers,Ball Arena,28/12/2024,02:00 UTC,"Cleveland Cavaliers vs Denver Nuggets @ Ball Arena, 2024-12-28 02:00 UTC",149.0,135.0
401704991,28/12/2024,Phoenix Suns,Dallas Mavericks,PHX Arena,28/12/2024,02:00 UTC,"Dallas Mavericks vs Phoenix Suns @ PHX Arena, 2024-12-28 02:00 UTC",98.0,89.0
401704992,28/12/2024,LA Clippers,Golden State Warriors,Intuit Dome,28/12/2024,03:00 UTC,"Golden State Warriors vs LA Clippers @ Intuit Dome, 2024-12-28 03:00 UTC",92.0,102.0
401704993,28/12/2024,Atlanta Hawks,Miami Heat,State Farm Arena,28/12/2024,20:00 UTC,"Miami Heat vs Atlanta Hawks @ State Farm Arena, 2024-12-28 20:00 UTC",110.0,120.0
401704994,28/12/2024,Charlotte Hornets,Oklahoma City Thunder,Spectrum Center,28/12/2024,23:00 UTC,"Oklahoma City Thunder vs Charlotte Hornets @ Spectrum Center, 2024-12-28 23:00 UTC",106.0,94.0
401704995,29/12/2024,Washington Wizards,New York Knicks,Capital One Arena,29/12/2024,00:00 UTC,"New York Knicks vs Washington Wizards @ Capital One Arena, 2024-12-29 00:00 UTC",136.0,132.0
401704996,29/12/2024,Chicago Bulls,Milwaukee Bucks,United Center,29/12/2024,01:00 UTC,"Milwaukee Bucks vs Chicago Bulls @ United Center, 2024-12-29 01:00 UTC",111.0,116.0
401704997,29/12/2024,Golden State Warriors,Phoenix Suns,Chase Center,29/12/2024,01:30 UTC,"Phoenix Suns vs Golden State Warriors @ Chase Center, 2024-12-29 01:30 UTC",105.0,109.0
401704998,29/12/2024,Denver Nuggets,Detroit Pistons,Ball Arena,29/12/2024,02:00 UTC,"Detroit Pistons vs Denver Nuggets @ Ball Arena, 2024-12-29 02:00 UTC",121.0,134.0
401704999,29/12/2024,Utah Jazz,Philadelphia 76ers,Delta Center,29/12/2024,02:30 UTC,"Philadelphia 76ers vs Utah Jazz @ Delta Center, 2024-12-29 02:30 UTC",114.0,111.0
401705000,29/12/2024,Portland Trail Blazers,Dallas Mavericks,Moda Center,29/12/2024,03:00 UTC,"Dallas Mavericks vs Portland Trail Blazers @ Moda Center, 2024-12-29 03:00 UTC",122.0,126.0
401705001,29/12/2024,Los Angeles Lakers,Sacramento Kings,crypto.com Arena,29/12/2024,03:30 UTC,"Sacramento Kings vs Los Angeles Lakers @ crypto.com Arena, 2024-12-29 03:30 UTC",122.0,132.0
401705002,29/12/2024,Orlando Magic,Brooklyn Nets,Kia Center,29/12/2024,20:30 UTC,"Brooklyn Nets vs Orlando Magic @ Kia Center, 2024-12-29 20:30 UTC",101.0,102.0
401705003,29/12/2024,Boston Celtics,Indiana Pacers,TD Garden,29/12/2024,23:00 UTC,"Indiana Pacers vs Boston Celtics @ TD Garden, 2024-12-29 23:00 UTC",123.0,114.0
401705004,29/12/2024,Toronto Raptors,Atlanta Hawks,Scotiabank Arena,29/12/2024,23:00 UTC,"Atlanta Hawks vs Toronto Raptors @ Scotiabank Arena, 2024-12-29 23:00 UTC",136.0,107.0
401705005,30/12/2024,Houston Rockets,Miami Heat,Toyota Center (Houston),30/12/2024,00:00 UTC,"Miami Heat vs Houston Rockets @ Toyota Center (Houston), 2024-12-30 00:00 UTC",104.0,100.0
401705006,30/12/2024,Oklahoma City Thunder,Memphis Grizzlies,Paycom Center,30/12/2024,00:00 UTC,"Memphis Grizzlies vs Oklahoma City Thunder @ Paycom Center, 2024-12-30 00:00 UTC",106.0,130.0
401705007,30/12/2024,Minnesota Timberwolves,San Antonio Spurs,Target Center,30/12/2024,02:00 UTC,"San Antonio Spurs vs Minnesota Timberwolves @ Target Center, 2024-12-30 02:00 UTC",110.0,112.0
401705008,31/12/2024,Charlotte Hornets,Chicago Bulls,Spectrum Center,31/12/2024,00:00 UTC,"Chicago Bulls vs Charlotte Hornets @ Spectrum Center, 2024-12-31 00:00 UTC",115.0,108.0
401705009,31/12/2024,Washington Wizards,New York Knicks,Capital One Arena,31/12/2024,00:00 UTC,"New York Knicks vs Washington Wizards @ Capital One Arena, 2024-12-31 00:00 UTC",126.0,106.0
401705010,31/12/2024,New Orleans Pelicans,LA Clippers,Smoothie King Center,31/12/2024,01:00 UTC,"LA Clippers vs New Orleans Pelicans @ Smoothie King Center, 2024-12-31 01:00 UTC",116.0,113.0
401705011,31/12/2024,Utah Jazz,Denver Nuggets,Delta Center,31/12/2024,02:00 UTC,"Denver Nuggets vs Utah Jazz @ Delta Center, 2024-12-31 02:00 UTC",132.0,121.0
401705012,31/12/2024,Golden State Warriors,Cleveland Cavaliers,Chase Center,31/12/2024,03:00 UTC,"Cleveland Cavaliers vs Golden State Warriors @ Chase Center, 2024-12-31 03:00 UTC",113.0,95.0
401705013,31/12/2024,Portland Trail Blazers,Philadelphia 76ers,Moda Center,31/12/2024,03:00 UTC,"Philadelphia 76ers vs Portland Trail Blazers @ Moda Center, 2024-12-31 03:00 UTC",125.0,103.0
401705014,31/12/2024,Sacramento Kings,Dallas Mavericks,Golden 1 Center,31/12/2024,03:00 UTC,"Dallas Mavericks vs Sacramento Kings @ Golden 1 Center, 2024-12-31 03:00 UTC",100.0,110.0
401705015,31/12/2024,Boston Celtics,Toronto Raptors,TD Garden,31/12/2024,20:00 UTC,"Toronto Raptors vs Boston Celtics @ TD Garden, 2024-12-31 20:00 UTC",71.0,125.0
401705016,31/12/2024,Indiana Pacers,Milwaukee Bucks,Gainbridge Fieldhouse,31/12/2024,20:00 UTC,"Milwaukee Bucks vs Indiana Pacers @ Gainbridge Fieldhouse, 2024-12-31 20:00 UTC",120.0,112.0
401705017,01/01/2025,San Antonio Spurs,LA Clippers,Frost Bank Center,01/01/2025,00:00 UTC,"LA Clippers vs San Antonio Spurs @ Frost Bank Center, 2025-01-01 00:00 UTC",86.0,122.0
401705018,01/01/2025,Oklahoma City Thunder,Minnesota Timberwolves,Paycom Center,01/01/2025,01:00 UTC,"Minnesota Timberwolves vs Oklahoma City Thunder @ Paycom Center, 2025-01-01 01:00 UTC",105.0,113.0
401705019,01/01/2025,Phoenix Suns,Memphis Grizzlies,PHX Arena,01/01/2025,02:00 UTC,"Memphis Grizzlies vs Phoenix Suns @ PHX Arena, 2025-01-01 02:00 UTC",117.0,112.0
401705020,01/01/2025,Los Angeles Lakers,Cleveland Cavaliers,crypto.com Arena,01/01/2025,02:00 UTC,"Cleveland Cavaliers vs Los Angeles Lakers @ crypto.com Arena, 2025-01-01 02:00 UTC",122.0,110.0
401705021,02/01/2025,Detroit Pistons,Orlando Magic,Little Caesars Arena,02/01/2025,00:00 UTC,"Orlando Magic vs Detroit Pistons @ Little Caesars Arena, 2025-01-02 00:00 UTC",96.0,105.0
401705022,02/01/2025,Washington Wizards,Chicago Bulls,Capital One Arena,02/01/2025,00:00 UTC,"Chicago Bulls vs Washington Wizards @ Capital One Arena, 2025-01-02 00:00 UTC",107.0,125.0
401705023,02/01/2025,Miami Heat,New Orleans Pelicans,Kaseya Center,02/01/2025,00:30 UTC,"New Orleans Pelicans vs Miami Heat @ Kaseya Center, 2025-01-02 00:30 UTC",108.0,119.0
401705024,02/01/2025,New York Knicks,Utah Jazz,Madison Square Garden,02/01/2025,00:30 UTC,"Utah Jazz vs New York Knicks @ Madison Square Garden, 2025-01-02 00:30 UTC",103.0,119.0
401705025,02/01/2025,Toronto Raptors,Brooklyn Nets,Scotiabank Arena,02/01/2025,00:30 UTC,"Brooklyn Nets vs Toronto Raptors @ Scotiabank Arena, 2025-01-02 00:30 UTC",113.0,130.0
401705026,02/01/2025,Houston Rockets,Dallas Mavericks,Toyota Center (Houston),02/01/2025,01:00 UTC,"Dallas Mavericks vs Houston Rockets @ Toyota Center (Houston), 2025-01-02 01:00 UTC",99.0,110.0
401705027,02/01/2025,Denver Nuggets,Atlanta Hawks,Ball Arena,02/01/2025,02:00 UTC,"Atlanta Hawks vs Denver Nuggets @ Ball Arena, 2025-01-02 02:00 UTC",120.0,139.0
401705028,02/01/2025,Sacramento Kings,Philadelphia 76ers,Golden 1 Center,02/01/2025,03:00 UTC,"Philadelphia 76ers vs Sacramento Kings @ Golden 1 Center, 2025-01-02 03:00 UTC",107.0,113.0
401705029,03/01/2025,Miami Heat,Indiana Pacers,Kaseya Center,03/01/2025,00:30 UTC,"Indiana Pacers vs Miami Heat @ Kaseya Center, 2025-01-03 00:30 UTC",128.0,115.0
401705030,03/01/2025,Minnesota Timberwolves,Boston Celtics,Target Center,03/01/2025,00:30 UTC,"Boston Celtics vs Minnesota Timberwolves @ Target Center, 2025-01-03 00:30 UTC",118.0,115.0
401705031,03/01/2025,Milwaukee Bucks,Brooklyn Nets,Fiserv Forum,03/01/2025,01:00 UTC,"Brooklyn Nets vs Milwaukee Bucks @ Fiserv Forum, 2025-01-03 01:00 UTC",113.0,110.0
401705032,03/01/2025,Oklahoma City Thunder,LA Clippers,Paycom Center,03/01/2025,01:00 UTC,"LA Clippers vs Oklahoma City Thunder @ Paycom Center, 2025-01-03 01:00 UTC",98.0,116.0
401705033,03/01/2025,Golden State Warriors,Philadelphia 76ers,Chase Center,03/01/2025,03:00 UTC,"Philadelphia 76ers vs Golden State Warriors @ Chase Center, 2025-01-03 03:00 UTC",105.0,139.0
401705034,03/01/2025,Los Angeles Lakers,Portland Trail Blazers,crypto.com Arena,03/01/2025,03:30 UTC,"Portland Trail Blazers vs Los Angeles Lakers @ crypto.com Arena, 2025-01-03 03:30 UTC",106.0,114.0
401705035,04/01/2025,Detroit Pistons,Charlotte Hornets,Little Caesars Arena,04/01/2025,00:00 UTC,"Charlotte Hornets vs Detroit Pistons @ Little Caesars Arena, 2025-01-04 00:00 UTC",94.0,98.0
401705036,04/01/2025,Toronto Raptors,Orlando Magic,Scotiabank Arena,04/01/2025,00:30 UTC,"Orlando Magic vs Toronto Raptors @ Scotiabank Arena, 2025-01-04 00:30 UTC",106.0,97.0
401705037,04/01/2025,Houston Rockets,Boston Celtics,Toyota Center (Houston),04/01/2025,01:00 UTC,"Boston Celtics vs Houston Rockets @ Toyota Center (Houston), 2025-01-04 01:00 UTC",109.0,86.0
401705038,04/01/2025,New Orleans Pelicans,Washington Wizards,Smoothie King Center,04/01/2025,01:00 UTC,"Washington Wizards vs New Orleans Pelicans @ Smoothie King Center, 2025-01-04 01:00 UTC",120.0,132.0
401705039,04/01/2025,Oklahoma City Thunder,New York Knicks,Paycom Center,04/01/2025,01:00 UTC,"New York Knicks vs Oklahoma City Thunder @ Paycom Center, 2025-01-04 01:00 UTC",107.0,117.0
401705040,04/01/2025,Dallas Mavericks,Cleveland Cavaliers,American Airlines Center,04/01/2025,01:30 UTC,"Cleveland Cavaliers vs Dallas Mavericks @ American Airlines Center, 2025-01-04 01:30 UTC",134.0,122.0
401705041,04/01/2025,Denver Nuggets,San Antonio Spurs,Ball Arena,04/01/2025,02:00 UTC,"San Antonio Spurs vs Denver Nuggets @ Ball Arena, 2025-01-04 02:00 UTC",113.0,110.0
401705042,04/01/2025,Sacramento Kings,Memphis Grizzlies,Golden 1 Center,04/01/2025,03:00 UTC,"Memphis Grizzlies vs Sacramento Kings @ Golden 1 Center, 2025-01-04 03:00 UTC",133.0,138.0
401705043,04/01/2025,Los Angeles Lakers,Atlanta Hawks,crypto.com Arena,04/01/2025,03:30 UTC,"Atlanta Hawks vs Los Angeles Lakers @ crypto.com Arena, 2025-01-04 03:30 UTC",102.0,119.0
401705044,04/01/2025,Brooklyn Nets,Philadelphia 76ers,Barclays Center,04/01/2025,23:00 UTC,"Philadelphia 76ers vs Brooklyn Nets @ Barclays Center, 2025-01-04 23:00 UTC",123.0,94.0
401705045,05/01/2025,Detroit Pistons,Minnesota Timberwolves,Little Caesars Arena,05/01/2025,00:00 UTC,"Minnesota Timberwolves vs Detroit Pistons @ Little Caesars Arena, 2025-01-05 00:00 UTC",105.0,119.0
401705046,05/01/2025,Indiana Pacers,Phoenix Suns,Gainbridge Fieldhouse,05/01/2025,00:00 UTC,"Phoenix Suns vs Indiana Pacers @ Gainbridge Fieldhouse, 2025-01-05 00:00 UTC",108.0,126.0
401705047,05/01/2025,Miami Heat,Utah Jazz,Kaseya Center,05/01/2025,01:00 UTC,"Utah Jazz vs Miami Heat @ Kaseya Center, 2025-01-05 01:00 UTC",136.0,100.0
401705048,05/01/2025,Chicago Bulls,New York Knicks,United Center,05/01/2025,01:00 UTC,"New York Knicks vs Chicago Bulls @ United Center, 2025-01-05 01:00 UTC",126.0,139.0
401705049,05/01/2025,Milwaukee Bucks,Portland Trail Blazers,Fiserv Forum,05/01/2025,01:00 UTC,"Portland Trail Blazers vs Milwaukee Bucks @ Fiserv Forum, 2025-01-05 01:00 UTC",105.0,102.0
401705050,05/01/2025,San Antonio Spurs,Denver Nuggets,Frost Bank Center,05/01/2025,01:00 UTC,"Denver Nuggets vs San Antonio Spurs @ Frost Bank Center, 2025-01-05 01:00 UTC",122.0,111.0
401705051,05/01/2025,Golden State Warriors,Memphis Grizzlies,Chase Center,05/01/2025,01:30 UTC,"Memphis Grizzlies vs Golden State Warriors @ Chase Center, 2025-01-05 01:30 UTC",113.0,121.0
401705052,05/01/2025,LA Clippers,Atlanta Hawks,Intuit Dome,05/01/2025,03:30 UTC,"Atlanta Hawks vs LA Clippers @ Intuit Dome, 2025-01-05 03:30 UTC",105.0,131.0
401705053,05/01/2025,Oklahoma City Thunder,Boston Celtics,Paycom Center,05/01/2025,20:30 UTC,"Boston Celtics vs Oklahoma City Thunder @ Paycom Center, 2025-01-05 20:30 UTC",92.0,105.0
401705054,05/01/2025,Cleveland Cavaliers,Charlotte Hornets,Rocket Arena,05/01/2025,23:00 UTC,"Charlotte Hornets vs Cleveland Cavaliers @ Rocket Arena, 2025-01-05 23:00 UTC",105.0,115.0
401705055,05/01/2025,Washington Wizards,New Orleans Pelicans,Capital One Arena,05/01/2025,23:00 UTC,"New Orleans Pelicans vs Washington Wizards @ Capital One Arena, 2025-01-05 23:00 UTC",110.0,98.0
401705056,05/01/2025,Orlando Magic,Utah Jazz,Kia Center,05/01/2025,23:30 UTC,"Utah Jazz vs Orlando Magic @ Kia Center, 2025-01-05 23:30 UTC",105.0,92.0
401705057,06/01/2025,Houston Rockets,Los Angeles Lakers,Toyota Center (Houston),06/01/2025,00:00 UTC,"Los Angeles Lakers vs Houston Rockets @ Toyota Center (Houston), 2025-01-06 00:00 UTC",115.0,119.0
401705058,06/01/2025,Golden State Warriors,Sacramento Kings,Chase Center,06/01/2025,01:30 UTC,"Sacramento Kings vs Golden State Warriors @ Chase Center, 2025-01-06 01:30 UTC",129.0,99.0
401705059,07/01/2025,Detroit Pistons,Portland Trail Blazers,Little Caesars Arena,07/01/2025,00:00 UTC,"Portland Trail Blazers vs Detroit Pistons @ Little Caesars Arena, 2025-01-07 00:00 UTC",115.0,118.0
401705060,07/01/2025,Philadelphia 76ers,Phoenix Suns,Wells Fargo Center,07/01/2025,00:00 UTC,"Phoenix Suns vs Philadelphia 76ers @ Wells Fargo Center, 2025-01-07 00:00 UTC",109.0,99.0
401705061,07/01/2025,Brooklyn Nets,Indiana Pacers,Barclays Center,07/01/2025,00:30 UTC,"Indiana Pacers vs Brooklyn Nets @ Barclays Center, 2025-01-07 00:30 UTC",113.0,99.0
401705062,07/01/2025,New York Knicks,Orlando Magic,Madison Square Garden,07/01/2025,00:30 UTC,"Orlando Magic vs New York Knicks @ Madison Square Garden, 2025-01-07 00:30 UTC",103.0,94.0
401705063,07/01/2025,Toronto Raptors,Milwaukee Bucks,Scotiabank Arena,07/01/2025,00:30 UTC,"Milwaukee Bucks vs Toronto Raptors @ Scotiabank Arena, 2025-01-07 00:30 UTC",128.0,104.0
401705064,07/01/2025,Chicago Bulls,San Antonio Spurs,United Center,07/01/2025,01:00 UTC,"San Antonio Spurs vs Chicago Bulls @ United Center, 2025-01-07 01:00 UTC",110.0,114.0
401705065,07/01/2025,Memphis Grizzlies,Dallas Mavericks,FedExForum,07/01/2025,01:00 UTC,"Dallas Mavericks vs Memphis Grizzlies @ FedExForum, 2025-01-07 01:00 UTC",104.0,119.0
401705066,07/01/2025,Minnesota Timberwolves,LA Clippers,Target Center,07/01/2025,01:00 UTC,"LA Clippers vs Minnesota Timberwolves @ Target Center, 2025-01-07 01:00 UTC",106.0,108.0
401705067,07/01/2025,Sacramento Kings,Miami Heat,Golden 1 Center,07/01/2025,03:00 UTC,"Miami Heat vs Sacramento Kings @ Golden 1 Center, 2025-01-07 03:00 UTC",118.0,123.0
401705068,08/01/2025,Charlotte Hornets,Phoenix Suns,Spectrum Center,08/01/2025,00:00 UTC,"Phoenix Suns vs Charlotte Hornets @ Spectrum Center, 2025-01-08 00:00 UTC",104.0,115.0
401705069,08/01/2025,Washington Wizards,Houston Rockets,Capital One Arena,08/01/2025,00:00 UTC,"Houston Rockets vs Washington Wizards @ Capital One Arena, 2025-01-08 00:00 UTC",135.0,112.0
401705070,08/01/2025,Dallas Mavericks,Los Angeles Lakers,American Airlines Center,08/01/2025,00:30 UTC,"Los Angeles Lakers vs Dallas Mavericks @ American Airlines Center, 2025-01-08 00:30 UTC",97.0,118.0
401705071,08/01/2025,New Orleans Pelicans,Minnesota Timberwolves,Smoothie King Center,08/01/2025,01:00 UTC,"Minnesota Timberwolves vs New Orleans Pelicans @ Smoothie King Center, 2025-01-08 01:00 UTC",104.0,97.0
401705072,08/01/2025,Utah Jazz,Atlanta Hawks,Delta Center,08/01/2025,02:00 UTC,"Atlanta Hawks vs Utah Jazz @ Delta Center, 2025-01-08 02:00 UTC",124.0,121.0
401705073,08/01/2025,Denver Nuggets,Boston Celtics,Ball Arena,08/01/2025,03:00 UTC,"Boston Celtics vs Denver Nuggets @ Ball Arena, 2025-01-08 03:00 UTC",118.0,106.0
401705074,08/01/2025,Golden State Warriors,Miami Heat,Chase Center,08/01/2025,03:00 UTC,"Miami Heat vs Golden State Warriors @ Chase Center, 2025-01-08 03:00 UTC",114.0,98.0
401705075,09/01/2025,Cleveland Cavaliers,Oklahoma City Thunder,Rocket Arena,09/01/2025,00:00 UTC,"Oklahoma City Thunder vs Cleveland Cavaliers @ Rocket Arena, 2025-01-09 00:00 UTC",122.0,129.0
401705076,09/01/2025,Indiana Pacers,Chicago Bulls,Gainbridge Fieldhouse,09/01/2025,00:00 UTC,"Chicago Bulls vs Indiana Pacers @ Gainbridge Fieldhouse, 2025-01-09 00:00 UTC",113.0,129.0
401705077,09/01/2025,New York Knicks,Toronto Raptors,Madison Square Garden,09/01/2025,00:30 UTC,"Toronto Raptors vs New York Knicks @ Madison Square Garden, 2025-01-09 00:30 UTC",98.0,112.0
401705078,09/01/2025,Philadelphia 76ers,Washington Wizards,Wells Fargo Center,09/01/2025,00:00 UTC,"Washington Wizards vs Philadelphia 76ers @ Wells Fargo Center, 2025-01-09 00:00 UTC",103.0,109.0
401705079,09/01/2025,Brooklyn Nets,Detroit Pistons,Barclays Center,09/01/2025,00:30 UTC,"Detroit Pistons vs Brooklyn Nets @ Barclays Center, 2025-01-09 00:30 UTC",113.0,98.0
401705080,09/01/2025,New Orleans Pelicans,Portland Trail Blazers,Smoothie King Center,09/01/2025,01:00 UTC,"Portland Trail Blazers vs New Orleans Pelicans @ Smoothie King Center, 2025-01-09 01:00 UTC",119.0,100.0
401705081,09/01/2025,Denver Nuggets,LA Clippers,Ball Arena,09/01/2025,02:00 UTC,"LA Clippers vs Denver Nuggets @ Ball Arena, 2025-01-09 02:00 UTC",103.0,126.0
401705082,09/01/2025,Milwaukee Bucks,San Antonio Spurs,Fiserv Forum,09/01/2025,02:30 UTC,"San Antonio Spurs vs Milwaukee Bucks @ Fiserv Forum, 2025-01-09 02:30 UTC",105.0,121.0
401705083,10/01/2025,Cleveland Cavaliers,Toronto Raptors,Rocket Arena,10/01/2025,00:00 UTC,"Toronto Raptors vs Cleveland Cavaliers @ Rocket Arena, 2025-01-10 00:00 UTC",126.0,132.0
401705084,10/01/2025,Detroit Pistons,Golden State Warriors,Little Caesars Arena,10/01/2025,00:00 UTC,"Golden State Warriors vs Detroit Pistons @ Little Caesars Arena, 2025-01-10 00:00 UTC",107.0,104.0
401705085,10/01/2025,Orlando Magic,Minnesota Timberwolves,Kia Center,10/01/2025,00:00 UTC,"Minnesota Timberwolves vs Orlando Magic @ Kia Center, 2025-01-10 00:00 UTC",104.0,89.0
401705086,10/01/2025,Memphis Grizzlies,Houston Rockets,FedExForum,10/01/2025,01:00 UTC,"Houston Rockets vs Memphis Grizzlies @ FedExForum, 2025-01-10 01:00 UTC",119.0,115.0
401705087,10/01/2025,Dallas Mavericks,Portland Trail Blazers,American Airlines Center,10/01/2025,00:30 UTC,"Portland Trail Blazers vs Dallas Mavericks @ American Airlines Center, 2025-01-10 00:30 UTC",111.0,117.0
401705088,10/01/2025,Phoenix Suns,Atlanta Hawks,PHX Arena,10/01/2025,02:00 UTC,"Atlanta Hawks vs Phoenix Suns @ PHX Arena, 2025-01-10 02:00 UTC",115.0,123.0
401705089,10/01/2025,Utah Jazz,Miami Heat,Delta Center,10/01/2025,02:00 UTC,"Miami Heat vs Utah Jazz @ Delta Center, 2025-01-10 02:00 UTC",97.0,92.0
401705091,11/01/2025,Indiana Pacers,Golden State Warriors,Gainbridge Fieldhouse,11/01/2025,00:00 UTC,"Golden State Warriors vs Indiana Pacers @ Gainbridge Fieldhouse, 2025-01-11 00:00 UTC",96.0,108.0
401705092,11/01/2025,Orlando Magic,Milwaukee Bucks,Kia Center,11/01/2025,00:00 UTC,"Milwaukee Bucks vs Orlando Magic @ Kia Center, 2025-01-11 00:00 UTC",109.0,106.0
401705093,11/01/2025,Philadelphia 76ers,New Orleans Pelicans,Wells Fargo Center,11/01/2025,00:00 UTC,"New Orleans Pelicans vs Philadelphia 76ers @ Wells Fargo Center, 2025-01-11 00:00 UTC",123.0,115.0
401705094,11/01/2025,Boston Celtics,Sacramento Kings,TD Garden,11/01/2025,00:30 UTC,"Sacramento Kings vs Boston Celtics @ TD Garden, 2025-01-11 00:30 UTC",114.0,97.0
401705095,11/01/2025,New York Knicks,Oklahoma City Thunder,Madison Square Garden,11/01/2025,00:30 UTC,"Oklahoma City Thunder vs New York Knicks @ Madison Square Garden, 2025-01-11 00:30 UTC",126.0,101.0
401705096,11/01/2025,Chicago Bulls,Washington Wizards,United Center,11/01/2025,01:00 UTC,"Washington Wizards vs Chicago Bulls @ United Center, 2025-01-11 01:00 UTC",105.0,138.0
401705097,11/01/2025,Denver Nuggets,Brooklyn Nets,Ball Arena,11/01/2025,02:00 UTC,"Brooklyn Nets vs Denver Nuggets @ Ball Arena, 2025-01-11 02:00 UTC",105.0,124.0
401705099,11/01/2025,Phoenix Suns,Utah Jazz,PHX Arena,11/01/2025,22:00 UTC,"Utah Jazz vs Phoenix Suns @ PHX Arena, 2025-01-11 22:00 UTC",106.0,114.0
401705100,12/01/2025,Detroit Pistons,Toronto Raptors,Little Caesars Arena,12/01/2025,00:00 UTC,"Toronto Raptors vs Detroit Pistons @ Little Caesars Arena, 2025-01-12 00:00 UTC",114.0,123.0
401705101,12/01/2025,Minnesota Timberwolves,Memphis Grizzlies,Target Center,12/01/2025,01:00 UTC,"Memphis Grizzlies vs Minnesota Timberwolves @ Target Center, 2025-01-12 01:00 UTC",127.0,125.0
401705102,12/01/2025,Portland Trail Blazers,Miami Heat,Moda Center,12/01/2025,03:00 UTC,"Miami Heat vs Portland Trail Blazers @ Moda Center, 2025-01-12 03:00 UTC",119.0,98.0
401705105,12/01/2025,New York Knicks,Milwaukee Bucks,Madison Square Garden,12/01/2025,20:00 UTC,"Milwaukee Bucks vs New York Knicks @ Madison Square Garden, 2025-01-12 20:00 UTC",106.0,140.0
401705106,12/01/2025,Dallas Mavericks,Denver Nuggets,American Airlines Center,12/01/2025,20:00 UTC,"Denver Nuggets vs Dallas Mavericks @ American Airlines Center, 2025-01-12 20:00 UTC",112.0,101.0
401705107,12/01/2025,Chicago Bulls,Sacramento Kings,United Center,12/01/2025,20:30 UTC,"Sacramento Kings vs Chicago Bulls @ United Center, 2025-01-12 20:30 UTC",124.0,119.0
401705108,12/01/2025,Boston Celtics,New Orleans Pelicans,TD Garden,12/01/2025,23:00 UTC,"New Orleans Pelicans vs Boston Celtics @ TD Garden, 2025-01-12 23:00 UTC",119.0,120.0
401705109,12/01/2025,Cleveland Cavaliers,Indiana Pacers,Rocket Arena,12/01/2025,23:00 UTC,"Indiana Pacers vs Cleveland Cavaliers @ Rocket Arena, 2025-01-12 23:00 UTC",108.0,93.0
401705110,12/01/2025,Orlando Magic,Philadelphia 76ers,Kia Center,12/01/2025,23:00 UTC,"Philadelphia 76ers vs Orlando Magic @ Kia Center, 2025-01-12 23:00 UTC",99.0,104.0
401705111,12/01/2025,Washington Wizards,Oklahoma City Thunder,Capital One Arena,12/01/2025,23:00 UTC,"Oklahoma City Thunder vs Washington Wizards @ Capital One Arena, 2025-01-12 23:00 UTC",136.0,95.0
401705112,13/01/2025,Utah Jazz,Brooklyn Nets,Delta Center,13/01/2025,01:00 UTC,"Brooklyn Nets vs Utah Jazz @ Delta Center, 2025-01-13 01:00 UTC",111.0,112.0
401705113,13/01/2025,Phoenix Suns,Charlotte Hornets,PHX Arena,13/01/2025,02:00 UTC,"Charlotte Hornets vs Phoenix Suns @ PHX Arena, 2025-01-13 02:00 UTC",113.0,120.0
401705114,14/01/2025,Washington Wizards,Minnesota Timberwolves,Capital One Arena,14/01/2025,00:00 UTC,"Minnesota Timberwolves vs Washington Wizards @ Capital One Arena, 2025-01-14 00:00 UTC",120.0,106.0
401705115,14/01/2025,New York Knicks,Detroit Pistons,Madison Square Garden,14/01/2025,00:30 UTC,"Detroit Pistons vs New York Knicks @ Madison Square Garden, 2025-01-14 00:30 UTC",124.0,119.0
401705116,14/01/2025,Toronto Raptors,Golden State Warriors,Scotiabank Arena,14/01/2025,00:30 UTC,"Golden State Warriors vs Toronto Raptors @ Scotiabank Arena, 2025-01-14 00:30 UTC",101.0,104.0
401705117,14/01/2025,Houston Rockets,Memphis Grizzlies,Toyota Center (Houston),14/01/2025,01:00 UTC,"Memphis Grizzlies vs Houston Rockets @ Toyota Center (Houston), 2025-01-14 01:00 UTC",118.0,120.0
401705118,14/01/2025,Los Angeles Lakers,San Antonio Spurs,crypto.com Arena,14/01/2025,03:30 UTC,"San Antonio Spurs vs Los Angeles Lakers @ crypto.com Arena, 2025-01-14 03:30 UTC",126.0,102.0
401705119,14/01/2025,LA Clippers,Miami Heat,Intuit Dome,14/01/2025,03:30 UTC,"Miami Heat vs LA Clippers @ Intuit Dome, 2025-01-14 03:30 UTC",98.0,109.0
401705120,15/01/2025,Indiana Pacers,Cleveland Cavaliers,Gainbridge Fieldhouse,15/01/2025,00:00 UTC,"Cleveland Cavaliers vs Indiana Pacers @ Gainbridge Fieldhouse, 2025-01-15 00:00 UTC",127.0,117.0
401705121,15/01/2025,Philadelphia 76ers,Oklahoma City Thunder,Wells Fargo Center,15/01/2025,00:00 UTC,"Oklahoma City Thunder vs Philadelphia 76ers @ Wells Fargo Center, 2025-01-15 00:00 UTC",118.0,102.0
401705122,15/01/2025,Atlanta Hawks,Phoenix Suns,State Farm Arena,15/01/2025,00:30 UTC,"Phoenix Suns vs Atlanta Hawks @ State Farm Arena, 2025-01-15 00:30 UTC",117.0,122.0
401705123,15/01/2025,Chicago Bulls,New Orleans Pelicans,United Center,15/01/2025,01:00 UTC,"New Orleans Pelicans vs Chicago Bulls @ United Center, 2025-01-15 01:00 UTC",119.0,113.0
401705124,15/01/2025,Milwaukee Bucks,Sacramento Kings,Fiserv Forum,15/01/2025,01:00 UTC,"Sacramento Kings vs Milwaukee Bucks @ Fiserv Forum, 2025-01-15 01:00 UTC",115.0,130.0
401705125,15/01/2025,Dallas Mavericks,Denver Nuggets,American Airlines Center,15/01/2025,02:30 UTC,"Denver Nuggets vs Dallas Mavericks @ American Airlines Center, 2025-01-15 02:30 UTC",118.0,99.0
401705126,15/01/2025,Portland Trail Blazers,Brooklyn Nets,Moda Center,15/01/2025,03:00 UTC,"Brooklyn Nets vs Portland Trail Blazers @ Moda Center, 2025-01-15 03:00 UTC",132.0,114.0
401705127,16/01/2025,Philadelphia 76ers,New York Knicks,Wells Fargo Center,16/01/2025,00:00 UTC,"New York Knicks vs Philadelphia 76ers @ Wells Fargo Center, 2025-01-16 00:00 UTC",125.0,119.0
401705128,16/01/2025,Toronto Raptors,Boston Celtics,Scotiabank Arena,16/01/2025,00:30 UTC,"Boston Celtics vs Toronto Raptors @ Scotiabank Arena, 2025-01-16 00:30 UTC",97.0,110.0
401705129,16/01/2025,Chicago Bulls,Atlanta Hawks,United Center,16/01/2025,01:00 UTC,"Atlanta Hawks vs Chicago Bulls @ United Center, 2025-01-16 01:00 UTC",110.0,94.0
401705130,16/01/2025,Milwaukee Bucks,Orlando Magic,Fiserv Forum,16/01/2025,01:00 UTC,"Orlando Magic vs Milwaukee Bucks @ Fiserv Forum, 2025-01-16 01:00 UTC",93.0,122.0
401705131,16/01/2025,Minnesota Timberwolves,Golden State Warriors,Target Center,16/01/2025,02:30 UTC,"Golden State Warriors vs Minnesota Timberwolves @ Target Center, 2025-01-16 02:30 UTC",116.0,115.0
401705132,16/01/2025,New Orleans Pelicans,Dallas Mavericks,Smoothie King Center,16/01/2025,01:00 UTC,"Dallas Mavericks vs New Orleans Pelicans @ Smoothie King Center, 2025-01-16 01:00 UTC",116.0,119.0
401705133,16/01/2025,San Antonio Spurs,Memphis Grizzlies,Frost Bank Center,16/01/2025,01:00 UTC,"Memphis Grizzlies vs San Antonio Spurs @ Frost Bank Center, 2025-01-16 01:00 UTC",129.0,115.0
401705134,16/01/2025,Denver Nuggets,Houston Rockets,Ball Arena,16/01/2025,02:00 UTC,"Houston Rockets vs Denver Nuggets @ Ball Arena, 2025-01-16 02:00 UTC",128.0,108.0
401705135,16/01/2025,Utah Jazz,Charlotte Hornets,Delta Center,16/01/2025,02:00 UTC,"Charlotte Hornets vs Utah Jazz @ Delta Center, 2025-01-16 02:00 UTC",117.0,112.0
401705136,16/01/2025,Los Angeles Lakers,Miami Heat,crypto.com Arena,16/01/2025,03:00 UTC,"Miami Heat vs Los Angeles Lakers @ crypto.com Arena, 2025-01-16 03:00 UTC",108.0,117.0
401705137,16/01/2025,LA Clippers,Brooklyn Nets,Intuit Dome,16/01/2025,03:30 UTC,"Brooklyn Nets vs LA Clippers @ Intuit Dome, 2025-01-16 03:30 UTC",67.0,126.0
401705138,17/01/2025,Detroit Pistons,Indiana Pacers,Little Caesars Arena,17/01/2025,00:00 UTC,"Indiana Pacers vs Detroit Pistons @ Little Caesars Arena, 2025-01-17 00:00 UTC",111.0,100.0
401705139,17/01/2025,Washington Wizards,Phoenix Suns,Capital One Arena,17/01/2025,00:00 UTC,"Phoenix Suns vs Washington Wizards @ Capital One Arena, 2025-01-17 00:00 UTC",130.0,123.0
401705140,17/01/2025,Oklahoma City Thunder,Cleveland Cavaliers,Paycom Center,17/01/2025,00:30 UTC,"Cleveland Cavaliers vs Oklahoma City Thunder @ Paycom Center, 2025-01-17 00:30 UTC",114.0,134.0
401705141,17/01/2025,Portland Trail Blazers,LA Clippers,Moda Center,17/01/2025,03:00 UTC,"LA Clippers vs Portland Trail Blazers @ Moda Center, 2025-01-17 03:00 UTC",118.0,89.0
401705142,17/01/2025,Sacramento Kings,Houston Rockets,Golden 1 Center,17/01/2025,03:00 UTC,"Houston Rockets vs Sacramento Kings @ Golden 1 Center, 2025-01-17 03:00 UTC",127.0,132.0
401705143,18/01/2025,Boston Celtics,Orlando Magic,TD Garden,18/01/2025,00:00 UTC,"Orlando Magic vs Boston Celtics @ TD Garden, 2025-01-18 00:00 UTC",94.0,121.0
401705144,18/01/2025,New York Knicks,Minnesota Timberwolves,Madison Square Garden,18/01/2025,00:30 UTC,"Minnesota Timberwolves vs New York Knicks @ Madison Square Garden, 2025-01-18 00:30 UTC",116.0,99.0
401705145,18/01/2025,Miami Heat,Denver Nuggets,Kaseya Center,18/01/2025,01:00 UTC,"Denver Nuggets vs Miami Heat @ Kaseya Center, 2025-01-18 01:00 UTC",133.0,113.0
401705146,18/01/2025,Milwaukee Bucks,Toronto Raptors,Fiserv Forum,18/01/2025,01:00 UTC,"Toronto Raptors vs Milwaukee Bucks @ Fiserv Forum, 2025-01-18 01:00 UTC",112.0,130.0
401705147,18/01/2025,New Orleans Pelicans,Utah Jazz,Smoothie King Center,18/01/2025,01:00 UTC,"Utah Jazz vs New Orleans Pelicans @ Smoothie King Center, 2025-01-18 01:00 UTC",123.0,136.0
401705148,18/01/2025,San Antonio Spurs,Memphis Grizzlies,Frost Bank Center,18/01/2025,02:30 UTC,"Memphis Grizzlies vs San Antonio Spurs @ Frost Bank Center, 2025-01-18 02:30 UTC",140.0,112.0
401705149,18/01/2025,Dallas Mavericks,Oklahoma City Thunder,American Airlines Center,18/01/2025,01:30 UTC,"Oklahoma City Thunder vs Dallas Mavericks @ American Airlines Center, 2025-01-18 01:30 UTC",98.0,106.0
401705150,18/01/2025,Chicago Bulls,Charlotte Hornets,United Center,18/01/2025,01:00 UTC,"Charlotte Hornets vs Chicago Bulls @ United Center, 2025-01-18 01:00 UTC",125.0,123.0
401705151,18/01/2025,Los Angeles Lakers,Brooklyn Nets,crypto.com Arena,18/01/2025,03:30 UTC,"Brooklyn Nets vs Los Angeles Lakers @ crypto.com Arena, 2025-01-18 03:30 UTC",101.0,102.0
401705152,18/01/2025,Detroit Pistons,Phoenix Suns,Little Caesars Arena,18/01/2025,21:00 UTC,"Phoenix Suns vs Detroit Pistons @ Little Caesars Arena, 2025-01-18 21:00 UTC",125.0,121.0
401705153,19/01/2025,Boston Celtics,Atlanta Hawks,TD Garden,19/01/2025,00:00 UTC,"Atlanta Hawks vs Boston Celtics @ TD Garden, 2025-01-19 00:00 UTC",119.0,115.0
401705154,19/01/2025,Indiana Pacers,Philadelphia 76ers,Gainbridge Fieldhouse,19/01/2025,00:00 UTC,"Philadelphia 76ers vs Indiana Pacers @ Gainbridge Fieldhouse, 2025-01-19 00:00 UTC",102.0,115.0
401705155,19/01/2025,Golden State Warriors,Washington Wizards,Chase Center,19/01/2025,01:30 UTC,"Washington Wizards vs Golden State Warriors @ Chase Center, 2025-01-19 01:30 UTC",114.0,122.0
401705156,19/01/2025,Minnesota Timberwolves,Cleveland Cavaliers,Target Center,19/01/2025,02:00 UTC,"Cleveland Cavaliers vs Minnesota Timberwolves @ Target Center, 2025-01-19 02:00 UTC",124.0,117.0
401705157,19/01/2025,Portland Trail Blazers,Houston Rockets,Moda Center,19/01/2025,03:00 UTC,"Houston Rockets vs Portland Trail Blazers @ Moda Center, 2025-01-19 03:00 UTC",125.0,103.0
401705158,19/01/2025,Miami Heat,San Antonio Spurs,Kaseya Center,19/01/2025,20:00 UTC,"San Antonio Spurs vs Miami Heat @ Kaseya Center, 2025-01-19 20:00 UTC",107.0,128.0
401705159,19/01/2025,Orlando Magic,Denver Nuggets,Kia Center,19/01/2025,23:00 UTC,"Denver Nuggets vs Orlando Magic @ Kia Center, 2025-01-19 23:00 UTC",113.0,100.0
401705160,20/01/2025,Milwaukee Bucks,Philadelphia 76ers,Fiserv Forum,20/01/2025,00:00 UTC,"Philadelphia 76ers vs Milwaukee Bucks @ Fiserv Forum, 2025-01-20 00:00 UTC",109.0,123.0
401705161,20/01/2025,Oklahoma City Thunder,Brooklyn Nets,Paycom Center,20/01/2025,00:00 UTC,"Brooklyn Nets vs Oklahoma City Thunder @ Paycom Center, 2025-01-20 00:00 UTC",101.0,127.0
401705162,20/01/2025,LA Clippers,Los Angeles Lakers,Intuit Dome,20/01/2025,02:00 UTC,"Los Angeles Lakers vs LA Clippers @ Intuit Dome, 2025-01-20 02:00 UTC",102.0,116.0
401705163,20/01/2025,Portland Trail Blazers,Chicago Bulls,Moda Center,20/01/2025,02:00 UTC,"Chicago Bulls vs Portland Trail Blazers @ Moda Center, 2025-01-20 02:00 UTC",102.0,113.0
401705164,20/01/2025,Sacramento Kings,Washington Wizards,Golden 1 Center,20/01/2025,02:00 UTC,"Washington Wizards vs Sacramento Kings @ Golden 1 Center, 2025-01-20 02:00 UTC",100.0,123.0
401705165,20/01/2025,Charlotte Hornets,Dallas Mavericks,Spectrum Center,20/01/2025,17:00 UTC,"Dallas Mavericks vs Charlotte Hornets @ Spectrum Center, 2025-01-20 17:00 UTC",105.0,110.0
401705166,20/01/2025,Houston Rockets,Detroit Pistons,Toyota Center (Houston),20/01/2025,19:00 UTC,"Detroit Pistons vs Houston Rockets @ Toyota Center (Houston), 2025-01-20 19:00 UTC",107.0,96.0
401705167,20/01/2025,Memphis Grizzlies,Minnesota Timberwolves,FedExForum,20/01/2025,19:30 UTC,"Minnesota Timberwolves vs Memphis Grizzlies @ FedExForum, 2025-01-20 19:30 UTC",106.0,108.0
401705168,20/01/2025,New York Knicks,Atlanta Hawks,Madison Square Garden,20/01/2025,20:00 UTC,"Atlanta Hawks vs New York Knicks @ Madison Square Garden, 2025-01-20 20:00 UTC",110.0,119.0
401705169,20/01/2025,Cleveland Cavaliers,Phoenix Suns,Rocket Arena,20/01/2025,20:30 UTC,"Phoenix Suns vs Cleveland Cavaliers @ Rocket Arena, 2025-01-20 20:30 UTC",92.0,118.0
401705170,20/01/2025,Golden State Warriors,Boston Celtics,Chase Center,20/01/2025,22:00 UTC,"Boston Celtics vs Golden State Warriors @ Chase Center, 2025-01-20 22:00 UTC",125.0,85.0
401705171,21/01/2025,New Orleans Pelicans,Utah Jazz,Smoothie King Center,21/01/2025,01:00 UTC,"Utah Jazz vs New Orleans Pelicans @ Smoothie King Center, 2025-01-21 01:00 UTC",119.0,123.0
401705172,22/01/2025,Brooklyn Nets,New York Knicks,Barclays Center,22/01/2025,00:30 UTC,"New York Knicks vs Brooklyn Nets @ Barclays Center, 2025-01-22 00:30 UTC",99.0,95.0
401705173,22/01/2025,Miami Heat,Portland Trail Blazers,Kaseya Center,22/01/2025,00:30 UTC,"Portland Trail Blazers vs Miami Heat @ Kaseya Center, 2025-01-22 00:30 UTC",116.0,107.0
401705174,22/01/2025,Toronto Raptors,Orlando Magic,Scotiabank Arena,22/01/2025,00:30 UTC,"Orlando Magic vs Toronto Raptors @ Scotiabank Arena, 2025-01-22 00:30 UTC",93.0,109.0
401705175,22/01/2025,Denver Nuggets,Philadelphia 76ers,Ball Arena,22/01/2025,03:00 UTC,"Philadelphia 76ers vs Denver Nuggets @ Ball Arena, 2025-01-22 03:00 UTC",109.0,144.0
401705176,22/01/2025,Los Angeles Lakers,Washington Wizards,crypto.com Arena,22/01/2025,03:30 UTC,"Washington Wizards vs Los Angeles Lakers @ crypto.com Arena, 2025-01-22 03:30 UTC",88.0,111.0
401705177,21/01/2025,LA Clippers,Chicago Bulls,Intuit Dome,21/01/2025,03:30 UTC,"Chicago Bulls vs LA Clippers @ Intuit Dome, 2025-01-21 03:30 UTC",112.0,99.0
401705178,23/01/2025,Atlanta Hawks,Detroit Pistons,State Farm Arena,23/01/2025,00:30 UTC,"Detroit Pistons vs Atlanta Hawks @ State Farm Arena, 2025-01-23 00:30 UTC",114.0,104.0
401705179,23/01/2025,Brooklyn Nets,Phoenix Suns,Barclays Center,23/01/2025,00:30 UTC,"Phoenix Suns vs Brooklyn Nets @ Barclays Center, 2025-01-23 00:30 UTC",108.0,84.0
401705180,23/01/2025,Dallas Mavericks,Minnesota Timberwolves,American Airlines Center,23/01/2025,00:30 UTC,"Minnesota Timberwolves vs Dallas Mavericks @ American Airlines Center, 2025-01-23 00:30 UTC",115.0,114.0
401705181,23/01/2025,Houston Rockets,Cleveland Cavaliers,Toyota Center (Houston),23/01/2025,01:00 UTC,"Cleveland Cavaliers vs Houston Rockets @ Toyota Center (Houston), 2025-01-23 01:00 UTC",108.0,109.0
401705182,23/01/2025,Memphis Grizzlies,Charlotte Hornets,FedExForum,23/01/2025,01:00 UTC,"Charlotte Hornets vs Memphis Grizzlies @ FedExForum, 2025-01-23 01:00 UTC",120.0,132.0
401705184,23/01/2025,Oklahoma City Thunder,Utah Jazz,Paycom Center,23/01/2025,01:00 UTC,"Utah Jazz vs Oklahoma City Thunder @ Paycom Center, 2025-01-23 01:00 UTC",114.0,123.0
401705185,23/01/2025,Sacramento Kings,Golden State Warriors,Golden 1 Center,23/01/2025,03:00 UTC,"Golden State Warriors vs Sacramento Kings @ Golden 1 Center, 2025-01-23 03:00 UTC",117.0,123.0
401705186,23/01/2025,LA Clippers,Boston Celtics,Intuit Dome,23/01/2025,03:30 UTC,"Boston Celtics vs LA Clippers @ Intuit Dome, 2025-01-23 03:30 UTC",117.0,113.0
401705187,23/01/2025,Indiana Pacers,San Antonio Spurs,Accor Arena,23/01/2025,19:00 UTC,"San Antonio Spurs vs Indiana Pacers @ Accor Arena, 2025-01-23 19:00 UTC",140.0,110.0
401705188,24/01/2025,Orlando Magic,Portland Trail Blazers,Kia Center,24/01/2025,00:00 UTC,"Portland Trail Blazers vs Orlando Magic @ Kia Center, 2025-01-24 00:00 UTC",101.0,79.0
401705189,24/01/2025,Atlanta Hawks,Toronto Raptors,State Farm Arena,24/01/2025,00:30 UTC,"Toronto Raptors vs Atlanta Hawks @ State Farm Arena, 2025-01-24 00:30 UTC",122.0,119.0
401705190,24/01/2025,Milwaukee Bucks,Miami Heat,Fiserv Forum,24/01/2025,01:30 UTC,"Miami Heat vs Milwaukee Bucks @ Fiserv Forum, 2025-01-24 01:30 UTC",96.0,125.0
401705191,24/01/2025,Oklahoma City Thunder,Dallas Mavericks,Paycom Center,24/01/2025,01:00 UTC,"Dallas Mavericks vs Oklahoma City Thunder @ Paycom Center, 2025-01-24 01:00 UTC",121.0,115.0
401705192,24/01/2025,Denver Nuggets,Sacramento Kings,Ball Arena,24/01/2025,02:00 UTC,"Sacramento Kings vs Denver Nuggets @ Ball Arena, 2025-01-24 02:00 UTC",123.0,132.0
401705193,20/03/2025,Utah Jazz,Washington Wizards,Delta Center,20/03/2025,01:00 UTC,"Washington Wizards vs Utah Jazz @ Delta Center, 2025-03-20 01:00 UTC",112.0,128.0
401705194,24/01/2025,Golden State Warriors,Chicago Bulls,Chase Center,24/01/2025,03:00 UTC,"Chicago Bulls vs Golden State Warriors @ Chase Center, 2025-01-24 03:00 UTC",106.0,131.0
401705195,24/01/2025,Los Angeles Lakers,Boston Celtics,crypto.com Arena,24/01/2025,03:00 UTC,"Boston Celtics vs Los Angeles Lakers @ crypto.com Arena, 2025-01-24 03:00 UTC",96.0,117.0
401705196,25/01/2025,Charlotte Hornets,Portland Trail Blazers,Spectrum Center,25/01/2025,00:00 UTC,"Portland Trail Blazers vs Charlotte Hornets @ Spectrum Center, 2025-01-25 00:00 UTC",102.0,97.0
401705197,25/01/2025,Philadelphia 76ers,Cleveland Cavaliers,Wells Fargo Center,25/01/2025,00:00 UTC,"Cleveland Cavaliers vs Philadelphia 76ers @ Wells Fargo Center, 2025-01-25 00:00 UTC",129.0,132.0
401705198,25/01/2025,Memphis Grizzlies,New Orleans Pelicans,FedExForum,25/01/2025,01:00 UTC,"New Orleans Pelicans vs Memphis Grizzlies @ FedExForum, 2025-01-25 01:00 UTC",126.0,139.0
401705199,25/01/2025,San Antonio Spurs,Indiana Pacers,Accor Arena,25/01/2025,17:00 UTC,"Indiana Pacers vs San Antonio Spurs @ Accor Arena, 2025-01-25 17:00 UTC",136.0,98.0
401705200,25/01/2025,Minnesota Timberwolves,Denver Nuggets,Target Center,25/01/2025,20:00 UTC,"Denver Nuggets vs Minnesota Timberwolves @ Target Center, 2025-01-25 20:00 UTC",104.0,133.0
401705201,25/01/2025,Dallas Mavericks,Boston Celtics,American Airlines Center,25/01/2025,22:30 UTC,"Boston Celtics vs Dallas Mavericks @ American Airlines Center, 2025-01-25 22:30 UTC",122.0,107.0
401705202,25/01/2025,Brooklyn Nets,Miami Heat,Barclays Center,25/01/2025,23:00 UTC,"Miami Heat vs Brooklyn Nets @ Barclays Center, 2025-01-25 23:00 UTC",106.0,97.0
401705203,26/01/2025,Charlotte Hornets,New Orleans Pelicans,Spectrum Center,26/01/2025,00:00 UTC,"New Orleans Pelicans vs Charlotte Hornets @ Spectrum Center, 2025-01-26 00:00 UTC",92.0,123.0
401705204,26/01/2025,Orlando Magic,Detroit Pistons,Kia Center,26/01/2025,00:00 UTC,"Detroit Pistons vs Orlando Magic @ Kia Center, 2025-01-26 00:00 UTC",113.0,121.0
401705205,26/01/2025,Atlanta Hawks,Toronto Raptors,State Farm Arena,26/01/2025,00:30 UTC,"Toronto Raptors vs Atlanta Hawks @ State Farm Arena, 2025-01-26 00:30 UTC",117.0,94.0
401705206,26/01/2025,Cleveland Cavaliers,Houston Rockets,Rocket Arena,26/01/2025,00:30 UTC,"Houston Rockets vs Cleveland Cavaliers @ Rocket Arena, 2025-01-26 00:30 UTC",135.0,131.0
401705207,26/01/2025,New York Knicks,Sacramento Kings,Madison Square Garden,26/01/2025,00:30 UTC,"Sacramento Kings vs New York Knicks @ Madison Square Garden, 2025-01-26 00:30 UTC",120.0,143.0
401705208,26/01/2025,Chicago Bulls,Philadelphia 76ers,United Center,26/01/2025,01:00 UTC,"Philadelphia 76ers vs Chicago Bulls @ United Center, 2025-01-26 01:00 UTC",109.0,97.0
401705209,26/01/2025,Memphis Grizzlies,Utah Jazz,FedExForum,26/01/2025,01:00 UTC,"Utah Jazz vs Memphis Grizzlies @ FedExForum, 2025-01-26 01:00 UTC",103.0,125.0
401705210,26/01/2025,Golden State Warriors,Los Angeles Lakers,Chase Center,26/01/2025,01:30 UTC,"Los Angeles Lakers vs Golden State Warriors @ Chase Center, 2025-01-26 01:30 UTC",118.0,108.0
401705211,26/01/2025,Phoenix Suns,Washington Wizards,PHX Arena,26/01/2025,02:00 UTC,"Washington Wizards vs Phoenix Suns @ PHX Arena, 2025-01-26 02:00 UTC",109.0,119.0
401705212,26/01/2025,LA Clippers,Milwaukee Bucks,Intuit Dome,26/01/2025,03:30 UTC,"Milwaukee Bucks vs LA Clippers @ Intuit Dome, 2025-01-26 03:30 UTC",117.0,127.0
401705213,26/01/2025,Portland Trail Blazers,Oklahoma City Thunder,Moda Center,26/01/2025,23:00 UTC,"Oklahoma City Thunder vs Portland Trail Blazers @ Moda Center, 2025-01-26 23:00 UTC",118.0,108.0
401705214,28/01/2025,Charlotte Hornets,Los Angeles Lakers,Spectrum Center,28/01/2025,00:00 UTC,"Los Angeles Lakers vs Charlotte Hornets @ Spectrum Center, 2025-01-28 00:00 UTC",112.0,107.0
401705215,28/01/2025,Cleveland Cavaliers,Detroit Pistons,Rocket Arena,28/01/2025,00:00 UTC,"Detroit Pistons vs Cleveland Cavaliers @ Rocket Arena, 2025-01-28 00:00 UTC",91.0,110.0
401705216,28/01/2025,Boston Celtics,Houston Rockets,TD Garden,28/01/2025,00:30 UTC,"Houston Rockets vs Boston Celtics @ TD Garden, 2025-01-28 00:30 UTC",114.0,112.0
401705217,28/01/2025,Brooklyn Nets,Sacramento Kings,Barclays Center,28/01/2025,00:30 UTC,"Sacramento Kings vs Brooklyn Nets @ Barclays Center, 2025-01-28 00:30 UTC",110.0,96.0
401705218,28/01/2025,Miami Heat,Orlando Magic,Kaseya Center,28/01/2025,00:30 UTC,"Orlando Magic vs Miami Heat @ Kaseya Center, 2025-01-28 00:30 UTC",119.0,125.0
401705219,28/01/2025,New York Knicks,Memphis Grizzlies,Madison Square Garden,28/01/2025,00:30 UTC,"Memphis Grizzlies vs New York Knicks @ Madison Square Garden, 2025-01-28 00:30 UTC",106.0,143.0
401705220,28/01/2025,Toronto Raptors,New Orleans Pelicans,Scotiabank Arena,28/01/2025,00:30 UTC,"New Orleans Pelicans vs Toronto Raptors @ Scotiabank Arena, 2025-01-28 00:30 UTC",104.0,113.0
401705221,28/01/2025,Chicago Bulls,Denver Nuggets,United Center,28/01/2025,01:00 UTC,"Denver Nuggets vs Chicago Bulls @ United Center, 2025-01-28 01:00 UTC",121.0,129.0
401705222,28/01/2025,Minnesota Timberwolves,Atlanta Hawks,Target Center,28/01/2025,01:00 UTC,"Atlanta Hawks vs Minnesota Timberwolves @ Target Center, 2025-01-28 01:00 UTC",92.0,100.0
401705223,28/01/2025,Dallas Mavericks,Washington Wizards,American Airlines Center,28/01/2025,01:30 UTC,"Washington Wizards vs Dallas Mavericks @ American Airlines Center, 2025-01-28 01:30 UTC",108.0,130.0
401705224,28/01/2025,Utah Jazz,Milwaukee Bucks,Delta Center,28/01/2025,02:00 UTC,"Milwaukee Bucks vs Utah Jazz @ Delta Center, 2025-01-28 02:00 UTC",125.0,110.0
401705225,28/01/2025,Phoenix Suns,LA Clippers,PHX Arena,28/01/2025,02:30 UTC,"LA Clippers vs Phoenix Suns @ PHX Arena, 2025-01-28 02:30 UTC",109.0,111.0
401705226,29/01/2025,Philadelphia 76ers,Los Angeles Lakers,Wells Fargo Center,29/01/2025,00:30 UTC,"Los Angeles Lakers vs Philadelphia 76ers @ Wells Fargo Center, 2025-01-29 00:30 UTC",104.0,118.0
401705227,29/01/2025,Golden State Warriors,Utah Jazz,Chase Center,29/01/2025,03:00 UTC,"Utah Jazz vs Golden State Warriors @ Chase Center, 2025-01-29 03:00 UTC",103.0,114.0
401705228,29/01/2025,Portland Trail Blazers,Milwaukee Bucks,Moda Center,29/01/2025,03:00 UTC,"Milwaukee Bucks vs Portland Trail Blazers @ Moda Center, 2025-01-29 03:00 UTC",112.0,125.0
401705229,30/01/2025,Charlotte Hornets,Brooklyn Nets,Spectrum Center,30/01/2025,00:00 UTC,"Brooklyn Nets vs Charlotte Hornets @ Spectrum Center, 2025-01-30 00:00 UTC",104.0,83.0
401705230,30/01/2025,Indiana Pacers,Detroit Pistons,Gainbridge Fieldhouse,30/01/2025,00:00 UTC,"Detroit Pistons vs Indiana Pacers @ Gainbridge Fieldhouse, 2025-01-30 00:00 UTC",119.0,133.0
401705231,30/01/2025,Washington Wizards,Toronto Raptors,Capital One Arena,30/01/2025,00:00 UTC,"Toronto Raptors vs Washington Wizards @ Capital One Arena, 2025-01-30 00:00 UTC",106.0,82.0
401705232,30/01/2025,Boston Celtics,Chicago Bulls,TD Garden,30/01/2025,00:30 UTC,"Chicago Bulls vs Boston Celtics @ TD Garden, 2025-01-30 00:30 UTC",100.0,122.0
401705233,30/01/2025,Miami Heat,Cleveland Cavaliers,Kaseya Center,30/01/2025,00:30 UTC,"Cleveland Cavaliers vs Miami Heat @ Kaseya Center, 2025-01-30 00:30 UTC",126.0,106.0
401705234,30/01/2025,New York Knicks,Denver Nuggets,Madison Square Garden,30/01/2025,00:30 UTC,"Denver Nuggets vs New York Knicks @ Madison Square Garden, 2025-01-30 00:30 UTC",112.0,122.0
401705235,30/01/2025,Philadelphia 76ers,Sacramento Kings,Wells Fargo Center,30/01/2025,00:30 UTC,"Sacramento Kings vs Philadelphia 76ers @ Wells Fargo Center, 2025-01-30 00:30 UTC",104.0,117.0
401705236,30/01/2025,New Orleans Pelicans,Dallas Mavericks,Smoothie King Center,30/01/2025,01:00 UTC,"Dallas Mavericks vs New Orleans Pelicans @ Smoothie King Center, 2025-01-30 01:00 UTC",137.0,136.0
401705237,30/01/2025,San Antonio Spurs,LA Clippers,Frost Bank Center,30/01/2025,01:00 UTC,"LA Clippers vs San Antonio Spurs @ Frost Bank Center, 2025-01-30 01:00 UTC",128.0,116.0
401705238,30/01/2025,Phoenix Suns,Minnesota Timberwolves,PHX Arena,30/01/2025,02:00 UTC,"Minnesota Timberwolves vs Phoenix Suns @ PHX Arena, 2025-01-30 02:00 UTC",121.0,113.0
401705239,30/01/2025,Golden State Warriors,Oklahoma City Thunder,Chase Center,30/01/2025,03:00 UTC,"Oklahoma City Thunder vs Golden State Warriors @ Chase Center, 2025-01-30 03:00 UTC",109.0,116.0
401705240,31/01/2025,Washington Wizards,Los Angeles Lakers,Capital One Arena,31/01/2025,00:00 UTC,"Los Angeles Lakers vs Washington Wizards @ Capital One Arena, 2025-01-31 00:00 UTC",134.0,95.0
401705241,31/01/2025,Cleveland Cavaliers,Atlanta Hawks,Rocket Arena,31/01/2025,00:00 UTC,"Atlanta Hawks vs Cleveland Cavaliers @ Rocket Arena, 2025-01-31 00:00 UTC",115.0,137.0
401705242,31/01/2025,Memphis Grizzlies,Houston Rockets,FedExForum,31/01/2025,02:30 UTC,"Houston Rockets vs Memphis Grizzlies @ FedExForum, 2025-01-31 02:30 UTC",119.0,120.0
401705243,31/01/2025,Utah Jazz,Minnesota Timberwolves,Delta Center,31/01/2025,02:00 UTC,"Minnesota Timberwolves vs Utah Jazz @ Delta Center, 2025-01-31 02:00 UTC",138.0,113.0
401705244,31/01/2025,Portland Trail Blazers,Orlando Magic,Moda Center,31/01/2025,03:00 UTC,"Orlando Magic vs Portland Trail Blazers @ Moda Center, 2025-01-31 03:00 UTC",90.0,119.0
401705245,01/02/2025,Charlotte Hornets,LA Clippers,Spectrum Center,01/02/2025,00:00 UTC,"LA Clippers vs Charlotte Hornets @ Spectrum Center, 2025-02-01 00:00 UTC",112.0,104.0
401705246,01/02/2025,Detroit Pistons,Dallas Mavericks,Little Caesars Arena,01/02/2025,00:00 UTC,"Dallas Mavericks vs Detroit Pistons @ Little Caesars Arena, 2025-02-01 00:00 UTC",102.0,117.0
401705247,01/02/2025,Philadelphia 76ers,Denver Nuggets,Wells Fargo Center,01/02/2025,00:30 UTC,"Denver Nuggets vs Philadelphia 76ers @ Wells Fargo Center, 2025-02-01 00:30 UTC",137.0,134.0
401705248,01/02/2025,Toronto Raptors,Chicago Bulls,Scotiabank Arena,01/02/2025,00:30 UTC,"Chicago Bulls vs Toronto Raptors @ Scotiabank Arena, 2025-02-01 00:30 UTC",122.0,106.0
401705249,01/02/2025,New Orleans Pelicans,Boston Celtics,Smoothie King Center,01/02/2025,01:00 UTC,"Boston Celtics vs New Orleans Pelicans @ Smoothie King Center, 2025-02-01 01:00 UTC",118.0,116.0
401705250,01/02/2025,San Antonio Spurs,Milwaukee Bucks,Frost Bank Center,01/02/2025,01:00 UTC,"Milwaukee Bucks vs San Antonio Spurs @ Frost Bank Center, 2025-02-01 01:00 UTC",118.0,144.0
401705251,01/02/2025,Golden State Warriors,Phoenix Suns,Chase Center,01/02/2025,03:00 UTC,"Phoenix Suns vs Golden State Warriors @ Chase Center, 2025-02-01 03:00 UTC",130.0,105.0
401705252,01/02/2025,Indiana Pacers,Atlanta Hawks,Gainbridge Fieldhouse,01/02/2025,22:00 UTC,"Atlanta Hawks vs Indiana Pacers @ Gainbridge Fieldhouse, 2025-02-01 22:00 UTC",127.0,132.0
401705253,01/02/2025,Utah Jazz,Orlando Magic,Delta Center,01/02/2025,22:00 UTC,"Orlando Magic vs Utah Jazz @ Delta Center, 2025-02-01 22:00 UTC",99.0,113.0
401705254,02/02/2025,Charlotte Hornets,Denver Nuggets,Spectrum Center,02/02/2025,00:00 UTC,"Denver Nuggets vs Charlotte Hornets @ Spectrum Center, 2025-02-02 00:00 UTC",107.0,104.0
401705255,02/02/2025,Houston Rockets,Brooklyn Nets,Toyota Center (Houston),02/02/2025,01:00 UTC,"Brooklyn Nets vs Houston Rockets @ Toyota Center (Houston), 2025-02-02 01:00 UTC",110.0,98.0
401705256,02/02/2025,Minnesota Timberwolves,Washington Wizards,Target Center,02/02/2025,01:00 UTC,"Washington Wizards vs Minnesota Timberwolves @ Target Center, 2025-02-02 01:00 UTC",105.0,103.0
401705257,02/02/2025,Oklahoma City Thunder,Sacramento Kings,Paycom Center,02/02/2025,01:00 UTC,"Sacramento Kings vs Oklahoma City Thunder @ Paycom Center, 2025-02-02 01:00 UTC",110.0,144.0
401705258,02/02/2025,New York Knicks,Los Angeles Lakers,Madison Square Garden,02/02/2025,01:30 UTC,"Los Angeles Lakers vs New York Knicks @ Madison Square Garden, 2025-02-02 01:30 UTC",128.0,112.0
401705259,02/02/2025,San Antonio Spurs,Miami Heat,Frost Bank Center,02/02/2025,01:30 UTC,"Miami Heat vs San Antonio Spurs @ Frost Bank Center, 2025-02-02 01:30 UTC",105.0,103.0
401705260,02/02/2025,Portland Trail Blazers,Phoenix Suns,Moda Center,02/02/2025,03:00 UTC,"Phoenix Suns vs Portland Trail Blazers @ Moda Center, 2025-02-02 03:00 UTC",108.0,127.0
401705261,02/02/2025,Detroit Pistons,Chicago Bulls,Little Caesars Arena,02/02/2025,20:00 UTC,"Chicago Bulls vs Detroit Pistons @ Little Caesars Arena, 2025-02-02 20:00 UTC",119.0,127.0
401705262,02/02/2025,Cleveland Cavaliers,Dallas Mavericks,Rocket Arena,02/02/2025,20:30 UTC,"Dallas Mavericks vs Cleveland Cavaliers @ Rocket Arena, 2025-02-02 20:30 UTC",101.0,144.0
401705263,02/02/2025,Toronto Raptors,LA Clippers,Scotiabank Arena,02/02/2025,20:30 UTC,"LA Clippers vs Toronto Raptors @ Scotiabank Arena, 2025-02-02 20:30 UTC",108.0,115.0
401705264,02/02/2025,Philadelphia 76ers,Boston Celtics,Wells Fargo Center,02/02/2025,23:00 UTC,"Boston Celtics vs Philadelphia 76ers @ Wells Fargo Center, 2025-02-02 23:00 UTC",118.0,110.0
401705265,03/02/2025,Milwaukee Bucks,Memphis Grizzlies,Fiserv Forum,03/02/2025,01:30 UTC,"Memphis Grizzlies vs Milwaukee Bucks @ Fiserv Forum, 2025-02-03 01:30 UTC",132.0,119.0
401705266,04/02/2025,Charlotte Hornets,Washington Wizards,Spectrum Center,04/02/2025,00:00 UTC,"Washington Wizards vs Charlotte Hornets @ Spectrum Center, 2025-02-04 00:00 UTC",124.0,114.0
401705267,04/02/2025,Detroit Pistons,Atlanta Hawks,Little Caesars Arena,04/02/2025,00:00 UTC,"Atlanta Hawks vs Detroit Pistons @ Little Caesars Arena, 2025-02-04 00:00 UTC",132.0,130.0
401705268,04/02/2025,New York Knicks,Houston Rockets,Madison Square Garden,04/02/2025,00:30 UTC,"Houston Rockets vs New York Knicks @ Madison Square Garden, 2025-02-04 00:30 UTC",118.0,124.0
401705269,04/02/2025,Memphis Grizzlies,San Antonio Spurs,FedExForum,04/02/2025,01:50 UTC,"San Antonio Spurs vs Memphis Grizzlies @ FedExForum, 2025-02-04 01:50 UTC",109.0,128.0
401705270,04/02/2025,Minnesota Timberwolves,Sacramento Kings,Target Center,04/02/2025,01:00 UTC,"Sacramento Kings vs Minnesota Timberwolves @ Target Center, 2025-02-04 01:00 UTC",116.0,114.0
401705271,04/02/2025,Oklahoma City Thunder,Milwaukee Bucks,Paycom Center,04/02/2025,01:00 UTC,"Milwaukee Bucks vs Oklahoma City Thunder @ Paycom Center, 2025-02-04 01:00 UTC",96.0,125.0
401705272,04/02/2025,Denver Nuggets,New Orleans Pelicans,Ball Arena,04/02/2025,02:00 UTC,"New Orleans Pelicans vs Denver Nuggets @ Ball Arena, 2025-02-04 02:00 UTC",113.0,125.0
401705273,04/02/2025,Utah Jazz,Indiana Pacers,Delta Center,04/02/2025,02:00 UTC,"Indiana Pacers vs Utah Jazz @ Delta Center, 2025-02-04 02:00 UTC",112.0,111.0
401705274,04/02/2025,Golden State Warriors,Orlando Magic,Chase Center,04/02/2025,03:00 UTC,"Orlando Magic vs Golden State Warriors @ Chase Center, 2025-02-04 03:00 UTC",99.0,104.0
401705275,04/02/2025,Portland Trail Blazers,Phoenix Suns,Moda Center,04/02/2025,03:00 UTC,"Phoenix Suns vs Portland Trail Blazers @ Moda Center, 2025-02-04 03:00 UTC",119.0,121.0
401705276,05/02/2025,Cleveland Cavaliers,Boston Celtics,Rocket Arena,05/02/2025,00:30 UTC,"Boston Celtics vs Cleveland Cavaliers @ Rocket Arena, 2025-02-05 00:30 UTC",112.0,105.0
401705277,05/02/2025,Brooklyn Nets,Houston Rockets,Barclays Center,05/02/2025,00:30 UTC,"Houston Rockets vs Brooklyn Nets @ Barclays Center, 2025-02-05 00:30 UTC",97.0,99.0
401705278,05/02/2025,Philadelphia 76ers,Dallas Mavericks,Wells Fargo Center,05/02/2025,00:00 UTC,"Dallas Mavericks vs Philadelphia 76ers @ Wells Fargo Center, 2025-02-05 00:00 UTC",116.0,118.0
401705279,05/02/2025,Toronto Raptors,New York Knicks,Scotiabank Arena,05/02/2025,00:30 UTC,"New York Knicks vs Toronto Raptors @ Scotiabank Arena, 2025-02-05 00:30 UTC",121.0,115.0
401705280,05/02/2025,Chicago Bulls,Miami Heat,United Center,05/02/2025,01:00 UTC,"Miami Heat vs Chicago Bulls @ United Center, 2025-02-05 01:00 UTC",124.0,133.0
401705281,05/02/2025,LA Clippers,Los Angeles Lakers,Intuit Dome,05/02/2025,03:00 UTC,"Los Angeles Lakers vs LA Clippers @ Intuit Dome, 2025-02-05 03:00 UTC",122.0,97.0
401705282,05/02/2025,Portland Trail Blazers,Indiana Pacers,Moda Center,05/02/2025,03:00 UTC,"Indiana Pacers vs Portland Trail Blazers @ Moda Center, 2025-02-05 03:00 UTC",89.0,112.0
401705283,06/02/2025,Charlotte Hornets,Milwaukee Bucks,Spectrum Center,06/02/2025,00:00 UTC,"Milwaukee Bucks vs Charlotte Hornets @ Spectrum Center, 2025-02-06 00:00 UTC",112.0,102.0
401705284,06/02/2025,Detroit Pistons,Cleveland Cavaliers,Little Caesars Arena,06/02/2025,00:00 UTC,"Cleveland Cavaliers vs Detroit Pistons @ Little Caesars Arena, 2025-02-06 00:00 UTC",118.0,115.0
401705285,06/02/2025,Atlanta Hawks,San Antonio Spurs,State Farm Arena,06/02/2025,00:00 UTC,"San Antonio Spurs vs Atlanta Hawks @ State Farm Arena, 2025-02-06 00:00 UTC",126.0,125.0
401705286,06/02/2025,Brooklyn Nets,Washington Wizards,Barclays Center,06/02/2025,00:30 UTC,"Washington Wizards vs Brooklyn Nets @ Barclays Center, 2025-02-06 00:30 UTC",119.0,102.0
401705287,06/02/2025,Philadelphia 76ers,Miami Heat,Wells Fargo Center,06/02/2025,00:30 UTC,"Miami Heat vs Philadelphia 76ers @ Wells Fargo Center, 2025-02-06 00:30 UTC",108.0,101.0
401705288,06/02/2025,Toronto Raptors,Memphis Grizzlies,Scotiabank Arena,06/02/2025,00:30 UTC,"Memphis Grizzlies vs Toronto Raptors @ Scotiabank Arena, 2025-02-06 00:30 UTC",138.0,107.0
401705289,06/02/2025,Minnesota Timberwolves,Chicago Bulls,Target Center,06/02/2025,01:00 UTC,"Chicago Bulls vs Minnesota Timberwolves @ Target Center, 2025-02-06 01:00 UTC",108.0,127.0
401705290,06/02/2025,Oklahoma City Thunder,Phoenix Suns,Paycom Center,06/02/2025,02:30 UTC,"Phoenix Suns vs Oklahoma City Thunder @ Paycom Center, 2025-02-06 02:30 UTC",109.0,140.0
401705291,06/02/2025,Utah Jazz,Golden State Warriors,Delta Center,06/02/2025,02:00 UTC,"Golden State Warriors vs Utah Jazz @ Delta Center, 2025-02-06 02:00 UTC",128.0,131.0
401705292,06/02/2025,Denver Nuggets,New Orleans Pelicans,Ball Arena,06/02/2025,02:00 UTC,"New Orleans Pelicans vs Denver Nuggets @ Ball Arena, 2025-02-06 02:00 UTC",119.0,144.0
401705293,06/02/2025,Sacramento Kings,Orlando Magic,Golden 1 Center,06/02/2025,03:00 UTC,"Orlando Magic vs Sacramento Kings @ Golden 1 Center, 2025-02-06 03:00 UTC",130.0,111.0
401705294,07/02/2025,Boston Celtics,Dallas Mavericks,TD Garden,07/02/2025,00:30 UTC,"Dallas Mavericks vs Boston Celtics @ TD Garden, 2025-02-07 00:30 UTC",127.0,120.0
401705295,07/02/2025,Minnesota Timberwolves,Houston Rockets,Target Center,07/02/2025,01:00 UTC,"Houston Rockets vs Minnesota Timberwolves @ Target Center, 2025-02-07 01:00 UTC",114.0,127.0
401705296,07/02/2025,Denver Nuggets,Orlando Magic,Ball Arena,07/02/2025,02:00 UTC,"Orlando Magic vs Denver Nuggets @ Ball Arena, 2025-02-07 02:00 UTC",90.0,112.0
401705297,07/02/2025,Los Angeles Lakers,Golden State Warriors,crypto.com Arena,07/02/2025,03:00 UTC,"Golden State Warriors vs Los Angeles Lakers @ crypto.com Arena, 2025-02-07 03:00 UTC",112.0,120.0
401705298,07/02/2025,Portland Trail Blazers,Sacramento Kings,Moda Center,07/02/2025,03:00 UTC,"Sacramento Kings vs Portland Trail Blazers @ Moda Center, 2025-02-07 03:00 UTC",102.0,108.0
401705299,07/02/2025,LA Clippers,Indiana Pacers,Intuit Dome,07/02/2025,03:30 UTC,"Indiana Pacers vs LA Clippers @ Intuit Dome, 2025-02-07 03:30 UTC",119.0,112.0
401705300,08/02/2025,Charlotte Hornets,San Antonio Spurs,Spectrum Center,08/02/2025,00:00 UTC,"San Antonio Spurs vs Charlotte Hornets @ Spectrum Center, 2025-02-08 00:00 UTC",116.0,117.0
401705301,08/02/2025,Washington Wizards,Cleveland Cavaliers,Capital One Arena,08/02/2025,00:00 UTC,"Cleveland Cavaliers vs Washington Wizards @ Capital One Arena, 2025-02-08 00:00 UTC",134.0,124.0
401705302,08/02/2025,Atlanta Hawks,Milwaukee Bucks,State Farm Arena,08/02/2025,00:30 UTC,"Milwaukee Bucks vs Atlanta Hawks @ State Farm Arena, 2025-02-08 00:30 UTC",110.0,115.0
401705303,08/02/2025,Brooklyn Nets,Miami Heat,Barclays Center,08/02/2025,00:30 UTC,"Miami Heat vs Brooklyn Nets @ Barclays Center, 2025-02-08 00:30 UTC",86.0,102.0
401705304,08/02/2025,Detroit Pistons,Philadelphia 76ers,Little Caesars Arena,08/02/2025,00:30 UTC,"Philadelphia 76ers vs Detroit Pistons @ Little Caesars Arena, 2025-02-08 00:30 UTC",112.0,125.0
401705305,08/02/2025,Oklahoma City Thunder,Toronto Raptors,Paycom Center,08/02/2025,01:00 UTC,"Toronto Raptors vs Oklahoma City Thunder @ Paycom Center, 2025-02-08 01:00 UTC",109.0,121.0
401705306,08/02/2025,Phoenix Suns,Utah Jazz,PHX Arena,08/02/2025,03:00 UTC,"Utah Jazz vs Phoenix Suns @ PHX Arena, 2025-02-08 03:00 UTC",127.0,135.0
401705307,08/02/2025,Dallas Mavericks,Houston Rockets,American Airlines Center,08/02/2025,20:00 UTC,"Houston Rockets vs Dallas Mavericks @ American Airlines Center, 2025-02-08 20:00 UTC",105.0,116.0
401705308,08/02/2025,Los Angeles Lakers,Indiana Pacers,crypto.com Arena,08/02/2025,21:00 UTC,"Indiana Pacers vs Los Angeles Lakers @ crypto.com Arena, 2025-02-08 21:00 UTC",117.0,124.0
401705309,09/02/2025,Orlando Magic,San Antonio Spurs,Kia Center,09/02/2025,00:00 UTC,"San Antonio Spurs vs Orlando Magic @ Kia Center, 2025-02-09 00:00 UTC",111.0,112.0
401705310,09/02/2025,Washington Wizards,Atlanta Hawks,Capital One Arena,09/02/2025,00:00 UTC,"Atlanta Hawks vs Washington Wizards @ Capital One Arena, 2025-02-09 00:00 UTC",125.0,111.0
401705311,09/02/2025,Chicago Bulls,Golden State Warriors,United Center,09/02/2025,01:00 UTC,"Golden State Warriors vs Chicago Bulls @ United Center, 2025-02-09 01:00 UTC",132.0,111.0
401705312,09/02/2025,Memphis Grizzlies,Oklahoma City Thunder,FedExForum,09/02/2025,01:00 UTC,"Oklahoma City Thunder vs Memphis Grizzlies @ FedExForum, 2025-02-09 01:00 UTC",125.0,112.0
401705313,09/02/2025,Minnesota Timberwolves,Portland Trail Blazers,Target Center,09/02/2025,01:00 UTC,"Portland Trail Blazers vs Minnesota Timberwolves @ Target Center, 2025-02-09 01:00 UTC",98.0,114.0
401705314,09/02/2025,New York Knicks,Boston Celtics,Madison Square Garden,09/02/2025,01:30 UTC,"Boston Celtics vs New York Knicks @ Madison Square Garden, 2025-02-09 01:30 UTC",131.0,104.0
401705315,09/02/2025,Phoenix Suns,Denver Nuggets,PHX Arena,09/02/2025,02:00 UTC,"Denver Nuggets vs Phoenix Suns @ PHX Arena, 2025-02-09 02:00 UTC",122.0,105.0
401705316,09/02/2025,Sacramento Kings,New Orleans Pelicans,Golden 1 Center,09/02/2025,03:00 UTC,"New Orleans Pelicans vs Sacramento Kings @ Golden 1 Center, 2025-02-09 03:00 UTC",118.0,123.0
401705317,09/02/2025,LA Clippers,Utah Jazz,Intuit Dome,09/02/2025,03:30 UTC,"Utah Jazz vs LA Clippers @ Intuit Dome, 2025-02-09 03:30 UTC",110.0,130.0
401705318,09/02/2025,Detroit Pistons,Charlotte Hornets,Little Caesars Arena,09/02/2025,18:00 UTC,"Charlotte Hornets vs Detroit Pistons @ Little Caesars Arena, 2025-02-09 18:00 UTC",102.0,112.0
401705319,09/02/2025,Houston Rockets,Toronto Raptors,Toyota Center (Houston),09/02/2025,19:00 UTC,"Toronto Raptors vs Houston Rockets @ Toyota Center (Houston), 2025-02-09 19:00 UTC",87.0,94.0
401705320,09/02/2025,Milwaukee Bucks,Philadelphia 76ers,Fiserv Forum,09/02/2025,19:00 UTC,"Philadelphia 76ers vs Milwaukee Bucks @ Fiserv Forum, 2025-02-09 19:00 UTC",127.0,135.0
401705321,11/02/2025,Cleveland Cavaliers,Minnesota Timberwolves,Rocket Arena,11/02/2025,00:00 UTC,"Minnesota Timberwolves vs Cleveland Cavaliers @ Rocket Arena, 2025-02-11 00:00 UTC",107.0,128.0
401705322,11/02/2025,Orlando Magic,Atlanta Hawks,Kia Center,11/02/2025,00:00 UTC,"Atlanta Hawks vs Orlando Magic @ Kia Center, 2025-02-11 00:00 UTC",112.0,106.0
401705323,11/02/2025,Washington Wizards,San Antonio Spurs,Capital One Arena,11/02/2025,00:00 UTC,"San Antonio Spurs vs Washington Wizards @ Capital One Arena, 2025-02-11 00:00 UTC",131.0,121.0
401705324,11/02/2025,Brooklyn Nets,Charlotte Hornets,Barclays Center,11/02/2025,00:30 UTC,"Charlotte Hornets vs Brooklyn Nets @ Barclays Center, 2025-02-11 00:30 UTC",89.0,97.0
401705325,11/02/2025,Miami Heat,Boston Celtics,Kaseya Center,11/02/2025,00:30 UTC,"Boston Celtics vs Miami Heat @ Kaseya Center, 2025-02-11 00:30 UTC",103.0,85.0
401705326,11/02/2025,Milwaukee Bucks,Golden State Warriors,Fiserv Forum,11/02/2025,01:00 UTC,"Golden State Warriors vs Milwaukee Bucks @ Fiserv Forum, 2025-02-11 01:00 UTC",124.0,111.0
401705327,11/02/2025,Oklahoma City Thunder,New Orleans Pelicans,Paycom Center,11/02/2025,01:00 UTC,"New Orleans Pelicans vs Oklahoma City Thunder @ Paycom Center, 2025-02-11 01:00 UTC",101.0,137.0
401705328,11/02/2025,Dallas Mavericks,Sacramento Kings,American Airlines Center,11/02/2025,01:30 UTC,"Sacramento Kings vs Dallas Mavericks @ American Airlines Center, 2025-02-11 01:30 UTC",129.0,128.0
401705329,11/02/2025,Denver Nuggets,Portland Trail Blazers,Ball Arena,11/02/2025,02:00 UTC,"Portland Trail Blazers vs Denver Nuggets @ Ball Arena, 2025-02-11 02:00 UTC",117.0,146.0
401705330,12/02/2025,Philadelphia 76ers,Toronto Raptors,Wells Fargo Center,12/02/2025,00:00 UTC,"Toronto Raptors vs Philadelphia 76ers @ Wells Fargo Center, 2025-02-12 00:00 UTC",106.0,103.0
401705331,12/02/2025,Indiana Pacers,New York Knicks,Gainbridge Fieldhouse,12/02/2025,00:30 UTC,"New York Knicks vs Indiana Pacers @ Gainbridge Fieldhouse, 2025-02-12 00:30 UTC",128.0,115.0
401705332,12/02/2025,Chicago Bulls,Detroit Pistons,United Center,12/02/2025,01:00 UTC,"Detroit Pistons vs Chicago Bulls @ United Center, 2025-02-12 01:00 UTC",132.0,92.0
401705333,12/02/2025,Phoenix Suns,Memphis Grizzlies,PHX Arena,12/02/2025,03:00 UTC,"Memphis Grizzlies vs Phoenix Suns @ PHX Arena, 2025-02-12 03:00 UTC",119.0,112.0
401705334,11/02/2025,Los Angeles Lakers,Utah Jazz,crypto.com Arena,11/02/2025,03:30 UTC,"Utah Jazz vs Los Angeles Lakers @ crypto.com Arena, 2025-02-11 03:30 UTC",113.0,132.0
401705335,13/02/2025,Boston Celtics,San Antonio Spurs,TD Garden,13/02/2025,00:00 UTC,"San Antonio Spurs vs Boston Celtics @ TD Garden, 2025-02-13 00:00 UTC",103.0,116.0
401705336,13/02/2025,Orlando Magic,Charlotte Hornets,Kia Center,13/02/2025,00:00 UTC,"Charlotte Hornets vs Orlando Magic @ Kia Center, 2025-02-13 00:00 UTC",86.0,102.0
401705337,13/02/2025,Washington Wizards,Indiana Pacers,Capital One Arena,13/02/2025,00:00 UTC,"Indiana Pacers vs Washington Wizards @ Capital One Arena, 2025-02-13 00:00 UTC",134.0,130.0
401705338,13/02/2025,Brooklyn Nets,Philadelphia 76ers,Barclays Center,13/02/2025,00:30 UTC,"Philadelphia 76ers vs Brooklyn Nets @ Barclays Center, 2025-02-13 00:30 UTC",96.0,100.0
401705339,13/02/2025,New York Knicks,Atlanta Hawks,Madison Square Garden,13/02/2025,00:30 UTC,"Atlanta Hawks vs New York Knicks @ Madison Square Garden, 2025-02-13 00:30 UTC",148.0,149.0
401705340,13/02/2025,Toronto Raptors,Cleveland Cavaliers,Scotiabank Arena,13/02/2025,00:30 UTC,"Cleveland Cavaliers vs Toronto Raptors @ Scotiabank Arena, 2025-02-13 00:30 UTC",131.0,108.0
401705341,13/02/2025,Chicago Bulls,Detroit Pistons,United Center,13/02/2025,01:00 UTC,"Detroit Pistons vs Chicago Bulls @ United Center, 2025-02-13 01:00 UTC",128.0,110.0
401705342,13/02/2025,Minnesota Timberwolves,Milwaukee Bucks,Target Center,13/02/2025,01:00 UTC,"Milwaukee Bucks vs Minnesota Timberwolves @ Target Center, 2025-02-13 01:00 UTC",103.0,101.0
401705343,13/02/2025,New Orleans Pelicans,Sacramento Kings,Smoothie King Center,13/02/2025,01:00 UTC,"Sacramento Kings vs New Orleans Pelicans @ Smoothie King Center, 2025-02-13 01:00 UTC",119.0,111.0
401705344,13/02/2025,Oklahoma City Thunder,Miami Heat,Paycom Center,13/02/2025,01:00 UTC,"Miami Heat vs Oklahoma City Thunder @ Paycom Center, 2025-02-13 01:00 UTC",101.0,115.0
401705345,13/02/2025,Houston Rockets,Phoenix Suns,Toyota Center (Houston),13/02/2025,01:30 UTC,"Phoenix Suns vs Houston Rockets @ Toyota Center (Houston), 2025-02-13 01:30 UTC",111.0,119.0
401705346,13/02/2025,Denver Nuggets,Portland Trail Blazers,Ball Arena,13/02/2025,02:00 UTC,"Portland Trail Blazers vs Denver Nuggets @ Ball Arena, 2025-02-13 02:00 UTC",121.0,132.0
401705347,13/02/2025,Utah Jazz,Los Angeles Lakers,Delta Center,13/02/2025,02:00 UTC,"Los Angeles Lakers vs Utah Jazz @ Delta Center, 2025-02-13 02:00 UTC",119.0,131.0
401705348,13/02/2025,Dallas Mavericks,Golden State Warriors,American Airlines Center,13/02/2025,02:30 UTC,"Golden State Warriors vs Dallas Mavericks @ American Airlines Center, 2025-02-13 02:30 UTC",107.0,111.0
401705349,13/02/2025,LA Clippers,Memphis Grizzlies,Intuit Dome,13/02/2025,03:30 UTC,"Memphis Grizzlies vs LA Clippers @ Intuit Dome, 2025-02-13 03:30 UTC",114.0,128.0
401705350,14/02/2025,Houston Rockets,Golden State Warriors,Toyota Center (Houston),14/02/2025,01:00 UTC,"Golden State Warriors vs Houston Rockets @ Toyota Center (Houston), 2025-02-14 01:00 UTC",105.0,98.0
401705351,14/02/2025,New Orleans Pelicans,Sacramento Kings,Smoothie King Center,14/02/2025,01:00 UTC,"Sacramento Kings vs New Orleans Pelicans @ Smoothie King Center, 2025-02-14 01:00 UTC",133.0,140.0
401705352,14/02/2025,Dallas Mavericks,Miami Heat,American Airlines Center,14/02/2025,01:30 UTC,"Miami Heat vs Dallas Mavericks @ American Airlines Center, 2025-02-14 01:30 UTC",113.0,118.0
401705353,14/02/2025,Minnesota Timberwolves,Oklahoma City Thunder,Target Center,14/02/2025,01:30 UTC,"Oklahoma City Thunder vs Minnesota Timberwolves @ Target Center, 2025-02-14 01:30 UTC",101.0,116.0
401705354,21/02/2025,Indiana Pacers,Memphis Grizzlies,Gainbridge Fieldhouse,21/02/2025,00:00 UTC,"Memphis Grizzlies vs Indiana Pacers @ Gainbridge Fieldhouse, 2025-02-21 00:00 UTC",113.0,127.0
401705355,21/02/2025,Philadelphia 76ers,Boston Celtics,Wells Fargo Center,21/02/2025,00:00 UTC,"Boston Celtics vs Philadelphia 76ers @ Wells Fargo Center, 2025-02-21 00:00 UTC",124.0,104.0
401705356,21/02/2025,Atlanta Hawks,Orlando Magic,State Farm Arena,21/02/2025,00:30 UTC,"Orlando Magic vs Atlanta Hawks @ State Farm Arena, 2025-02-21 00:30 UTC",114.0,108.0
401705357,21/02/2025,Brooklyn Nets,Cleveland Cavaliers,Barclays Center,21/02/2025,00:30 UTC,"Cleveland Cavaliers vs Brooklyn Nets @ Barclays Center, 2025-02-21 00:30 UTC",110.0,97.0
401705358,21/02/2025,New York Knicks,Chicago Bulls,Madison Square Garden,21/02/2025,00:30 UTC,"Chicago Bulls vs New York Knicks @ Madison Square Garden, 2025-02-21 00:30 UTC",111.0,113.0
401705359,21/02/2025,Milwaukee Bucks,LA Clippers,Fiserv Forum,21/02/2025,01:00 UTC,"LA Clippers vs Milwaukee Bucks @ Fiserv Forum, 2025-02-21 01:00 UTC",110.0,116.0
401705360,21/02/2025,Denver Nuggets,Charlotte Hornets,Ball Arena,21/02/2025,02:00 UTC,"Charlotte Hornets vs Denver Nuggets @ Ball Arena, 2025-02-21 02:00 UTC",115.0,129.0
401705361,21/02/2025,San Antonio Spurs,Phoenix Suns,Moody Center,21/02/2025,02:30 UTC,"Phoenix Suns vs San Antonio Spurs @ Moody Center, 2025-02-21 02:30 UTC",109.0,120.0
401705362,21/02/2025,Portland Trail Blazers,Los Angeles Lakers,Moda Center,21/02/2025,03:00 UTC,"Los Angeles Lakers vs Portland Trail Blazers @ Moda Center, 2025-02-21 03:00 UTC",110.0,102.0
401705363,22/02/2025,Cleveland Cavaliers,New York Knicks,Rocket Arena,22/02/2025,00:00 UTC,"New York Knicks vs Cleveland Cavaliers @ Rocket Arena, 2025-02-22 00:00 UTC",105.0,142.0
401705364,22/02/2025,Orlando Magic,Memphis Grizzlies,Kia Center,22/02/2025,00:00 UTC,"Memphis Grizzlies vs Orlando Magic @ Kia Center, 2025-02-22 00:00 UTC",105.0,104.0
401705365,22/02/2025,Washington Wizards,Milwaukee Bucks,Capital One Arena,22/02/2025,00:00 UTC,"Milwaukee Bucks vs Washington Wizards @ Capital One Arena, 2025-02-22 00:00 UTC",104.0,101.0
401705366,22/02/2025,Toronto Raptors,Miami Heat,Scotiabank Arena,22/02/2025,00:30 UTC,"Miami Heat vs Toronto Raptors @ Scotiabank Arena, 2025-02-22 00:30 UTC",120.0,111.0
401705367,22/02/2025,Houston Rockets,Minnesota Timberwolves,Toyota Center (Houston),22/02/2025,02:30 UTC,"Minnesota Timberwolves vs Houston Rockets @ Toyota Center (Houston), 2025-02-22 02:30 UTC",115.0,121.0
401705368,22/02/2025,San Antonio Spurs,Detroit Pistons,Moody Center,22/02/2025,01:30 UTC,"Detroit Pistons vs San Antonio Spurs @ Moody Center, 2025-02-22 01:30 UTC",125.0,110.0
401705369,22/02/2025,Dallas Mavericks,New Orleans Pelicans,American Airlines Center,22/02/2025,01:30 UTC,"New Orleans Pelicans vs Dallas Mavericks @ American Airlines Center, 2025-02-22 01:30 UTC",103.0,111.0
401705370,22/02/2025,Utah Jazz,Oklahoma City Thunder,Delta Center,22/02/2025,02:30 UTC,"Oklahoma City Thunder vs Utah Jazz @ Delta Center, 2025-02-22 02:30 UTC",130.0,107.0
401705371,22/02/2025,Sacramento Kings,Golden State Warriors,Golden 1 Center,22/02/2025,03:00 UTC,"Golden State Warriors vs Sacramento Kings @ Golden 1 Center, 2025-02-22 03:00 UTC",132.0,108.0
401705372,22/02/2025,Chicago Bulls,Phoenix Suns,United Center,22/02/2025,22:00 UTC,"Phoenix Suns vs Chicago Bulls @ United Center, 2025-02-22 22:00 UTC",121.0,117.0
401705373,23/02/2025,Philadelphia 76ers,Brooklyn Nets,Wells Fargo Center,23/02/2025,00:30 UTC,"Brooklyn Nets vs Philadelphia 76ers @ Wells Fargo Center, 2025-02-23 00:30 UTC",105.0,103.0
401705374,23/02/2025,Denver Nuggets,Los Angeles Lakers,Ball Arena,23/02/2025,01:30 UTC,"Los Angeles Lakers vs Denver Nuggets @ Ball Arena, 2025-02-23 01:30 UTC",123.0,100.0
401705375,23/02/2025,Utah Jazz,Houston Rockets,Delta Center,23/02/2025,02:30 UTC,"Houston Rockets vs Utah Jazz @ Delta Center, 2025-02-23 02:30 UTC",115.0,124.0
401705376,23/02/2025,Portland Trail Blazers,Charlotte Hornets,Moda Center,23/02/2025,03:00 UTC,"Charlotte Hornets vs Portland Trail Blazers @ Moda Center, 2025-02-23 03:00 UTC",88.0,141.0
401705377,23/02/2025,Boston Celtics,New York Knicks,TD Garden,23/02/2025,18:00 UTC,"New York Knicks vs Boston Celtics @ TD Garden, 2025-02-23 18:00 UTC",105.0,118.0
401705378,23/02/2025,Golden State Warriors,Dallas Mavericks,Chase Center,23/02/2025,20:30 UTC,"Dallas Mavericks vs Golden State Warriors @ Chase Center, 2025-02-23 20:30 UTC",102.0,126.0
401705379,23/02/2025,Indiana Pacers,LA Clippers,Gainbridge Fieldhouse,23/02/2025,22:00 UTC,"LA Clippers vs Indiana Pacers @ Gainbridge Fieldhouse, 2025-02-23 22:00 UTC",111.0,129.0
401705380,23/02/2025,Atlanta Hawks,Detroit Pistons,State Farm Arena,23/02/2025,23:00 UTC,"Detroit Pistons vs Atlanta Hawks @ State Farm Arena, 2025-02-23 23:00 UTC",148.0,143.0
401705381,23/02/2025,Orlando Magic,Washington Wizards,Kia Center,23/02/2025,23:00 UTC,"Washington Wizards vs Orlando Magic @ Kia Center, 2025-02-23 23:00 UTC",90.0,110.0
401705382,23/02/2025,Toronto Raptors,Phoenix Suns,Scotiabank Arena,23/02/2025,23:00 UTC,"Phoenix Suns vs Toronto Raptors @ Scotiabank Arena, 2025-02-23 23:00 UTC",109.0,127.0
401705383,23/02/2025,Milwaukee Bucks,Miami Heat,Fiserv Forum,23/02/2025,23:00 UTC,"Miami Heat vs Milwaukee Bucks @ Fiserv Forum, 2025-02-23 23:00 UTC",113.0,120.0
401705384,24/02/2025,New Orleans Pelicans,San Antonio Spurs,Smoothie King Center,24/02/2025,00:00 UTC,"San Antonio Spurs vs New Orleans Pelicans @ Smoothie King Center, 2025-02-24 00:00 UTC",96.0,114.0
401705385,24/02/2025,Cleveland Cavaliers,Memphis Grizzlies,Rocket Arena,24/02/2025,00:00 UTC,"Memphis Grizzlies vs Cleveland Cavaliers @ Rocket Arena, 2025-02-24 00:00 UTC",123.0,129.0
401705386,24/02/2025,Minnesota Timberwolves,Oklahoma City Thunder,Target Center,24/02/2025,02:50 UTC,"Oklahoma City Thunder vs Minnesota Timberwolves @ Target Center, 2025-02-24 02:50 UTC",130.0,123.0
401705387,25/02/2025,Detroit Pistons,LA Clippers,Little Caesars Arena,25/02/2025,00:00 UTC,"LA Clippers vs Detroit Pistons @ Little Caesars Arena, 2025-02-25 00:00 UTC",97.0,106.0
401705388,25/02/2025,Indiana Pacers,Denver Nuggets,Gainbridge Fieldhouse,25/02/2025,00:00 UTC,"Denver Nuggets vs Indiana Pacers @ Gainbridge Fieldhouse, 2025-02-25 00:00 UTC",125.0,116.0
401705389,25/02/2025,Philadelphia 76ers,Chicago Bulls,Wells Fargo Center,25/02/2025,00:00 UTC,"Chicago Bulls vs Philadelphia 76ers @ Wells Fargo Center, 2025-02-25 00:00 UTC",142.0,110.0
401705390,25/02/2025,Washington Wizards,Brooklyn Nets,Capital One Arena,25/02/2025,00:00 UTC,"Brooklyn Nets vs Washington Wizards @ Capital One Arena, 2025-02-25 00:00 UTC",99.0,107.0
401705391,25/02/2025,Atlanta Hawks,Miami Heat,State Farm Arena,25/02/2025,00:30 UTC,"Miami Heat vs Atlanta Hawks @ State Farm Arena, 2025-02-25 00:30 UTC",86.0,98.0
401705392,25/02/2025,Oklahoma City Thunder,Minnesota Timberwolves,Paycom Center,25/02/2025,01:00 UTC,"Minnesota Timberwolves vs Oklahoma City Thunder @ Paycom Center, 2025-02-25 01:00 UTC",131.0,128.0
401705393,25/02/2025,Utah Jazz,Portland Trail Blazers,Delta Center,25/02/2025,02:00 UTC,"Portland Trail Blazers vs Utah Jazz @ Delta Center, 2025-02-25 02:00 UTC",114.0,112.0
401705394,25/02/2025,Sacramento Kings,Charlotte Hornets,Golden 1 Center,25/02/2025,03:00 UTC,"Charlotte Hornets vs Sacramento Kings @ Golden 1 Center, 2025-02-25 03:00 UTC",88.0,130.0
401705395,26/02/2025,Toronto Raptors,Boston Celtics,Scotiabank Arena,26/02/2025,00:00 UTC,"Boston Celtics vs Toronto Raptors @ Scotiabank Arena, 2025-02-26 00:00 UTC",111.0,101.0
401705396,26/02/2025,Orlando Magic,Cleveland Cavaliers,Kia Center,26/02/2025,00:30 UTC,"Cleveland Cavaliers vs Orlando Magic @ Kia Center, 2025-02-26 00:30 UTC",122.0,82.0
401705397,26/02/2025,Houston Rockets,Milwaukee Bucks,Toyota Center (Houston),26/02/2025,01:00 UTC,"Milwaukee Bucks vs Houston Rockets @ Toyota Center (Houston), 2025-02-26 01:00 UTC",97.0,100.0
401705398,26/02/2025,Memphis Grizzlies,Phoenix Suns,FedExForum,26/02/2025,01:00 UTC,"Phoenix Suns vs Memphis Grizzlies @ FedExForum, 2025-02-26 01:00 UTC",148.0,151.0
401705399,26/02/2025,New Orleans Pelicans,San Antonio Spurs,Smoothie King Center,26/02/2025,01:00 UTC,"San Antonio Spurs vs New Orleans Pelicans @ Smoothie King Center, 2025-02-26 01:00 UTC",103.0,109.0
401705400,26/02/2025,Golden State Warriors,Charlotte Hornets,Chase Center,26/02/2025,03:00 UTC,"Charlotte Hornets vs Golden State Warriors @ Chase Center, 2025-02-26 03:00 UTC",92.0,128.0
401705401,26/02/2025,Los Angeles Lakers,Dallas Mavericks,crypto.com Arena,26/02/2025,03:00 UTC,"Dallas Mavericks vs Los Angeles Lakers @ crypto.com Arena, 2025-02-26 03:00 UTC",99.0,107.0
401705402,27/02/2025,Detroit Pistons,Boston Celtics,Little Caesars Arena,27/02/2025,00:00 UTC,"Boston Celtics vs Detroit Pistons @ Little Caesars Arena, 2025-02-27 00:00 UTC",97.0,117.0
401705403,27/02/2025,Indiana Pacers,Toronto Raptors,Gainbridge Fieldhouse,27/02/2025,00:00 UTC,"Toronto Raptors vs Indiana Pacers @ Gainbridge Fieldhouse, 2025-02-27 00:00 UTC",91.0,111.0
401705404,27/02/2025,New York Knicks,Philadelphia 76ers,Madison Square Garden,27/02/2025,00:00 UTC,"Philadelphia 76ers vs New York Knicks @ Madison Square Garden, 2025-02-27 00:00 UTC",105.0,110.0
401705405,27/02/2025,Washington Wizards,Portland Trail Blazers,Capital One Arena,27/02/2025,00:00 UTC,"Portland Trail Blazers vs Washington Wizards @ Capital One Arena, 2025-02-27 00:00 UTC",129.0,121.0
401705406,27/02/2025,Brooklyn Nets,Oklahoma City Thunder,Barclays Center,27/02/2025,00:30 UTC,"Oklahoma City Thunder vs Brooklyn Nets @ Barclays Center, 2025-02-27 00:30 UTC",129.0,121.0
401705407,27/02/2025,Miami Heat,Atlanta Hawks,Kaseya Center,27/02/2025,00:30 UTC,"Atlanta Hawks vs Miami Heat @ Kaseya Center, 2025-02-27 00:30 UTC",109.0,131.0
401705408,27/02/2025,Chicago Bulls,LA Clippers,United Center,27/02/2025,01:00 UTC,"LA Clippers vs Chicago Bulls @ United Center, 2025-02-27 01:00 UTC",122.0,117.0
401705409,27/02/2025,Utah Jazz,Sacramento Kings,Delta Center,27/02/2025,02:00 UTC,"Sacramento Kings vs Utah Jazz @ Delta Center, 2025-02-27 02:00 UTC",118.0,101.0
401705410,27/02/2025,Houston Rockets,San Antonio Spurs,Toyota Center (Houston),27/02/2025,02:50 UTC,"San Antonio Spurs vs Houston Rockets @ Toyota Center (Houston), 2025-02-27 02:50 UTC",106.0,118.0
401705411,28/02/2025,Orlando Magic,Golden State Warriors,Kia Center,28/02/2025,00:00 UTC,"Golden State Warriors vs Orlando Magic @ Kia Center, 2025-02-28 00:00 UTC",121.0,115.0
401705412,28/02/2025,Milwaukee Bucks,Denver Nuggets,Fiserv Forum,28/02/2025,01:00 UTC,"Denver Nuggets vs Milwaukee Bucks @ Fiserv Forum, 2025-02-28 01:00 UTC",112.0,121.0
401705413,28/02/2025,Dallas Mavericks,Charlotte Hornets,American Airlines Center,28/02/2025,01:30 UTC,"Charlotte Hornets vs Dallas Mavericks @ American Airlines Center, 2025-02-28 01:30 UTC",96.0,103.0
401705414,28/02/2025,Phoenix Suns,New Orleans Pelicans,PHX Arena,28/02/2025,02:00 UTC,"New Orleans Pelicans vs Phoenix Suns @ PHX Arena, 2025-02-28 02:00 UTC",124.0,116.0
401705415,28/02/2025,Los Angeles Lakers,Minnesota Timberwolves,crypto.com Arena,28/02/2025,03:30 UTC,"Minnesota Timberwolves vs Los Angeles Lakers @ crypto.com Arena, 2025-02-28 03:30 UTC",102.0,111.0
401705416,01/03/2025,Detroit Pistons,Denver Nuggets,Little Caesars Arena,01/03/2025,00:00 UTC,"Denver Nuggets vs Detroit Pistons @ Little Caesars Arena, 2025-03-01 00:00 UTC",134.0,119.0
401705417,01/03/2025,Atlanta Hawks,Oklahoma City Thunder,State Farm Arena,01/03/2025,00:30 UTC,"Oklahoma City Thunder vs Atlanta Hawks @ State Farm Arena, 2025-03-01 00:30 UTC",135.0,119.0
401705418,01/03/2025,Boston Celtics,Cleveland Cavaliers,TD Garden,01/03/2025,00:30 UTC,"Cleveland Cavaliers vs Boston Celtics @ TD Garden, 2025-03-01 00:30 UTC",123.0,116.0
401705419,01/03/2025,Brooklyn Nets,Portland Trail Blazers,Barclays Center,01/03/2025,00:30 UTC,"Portland Trail Blazers vs Brooklyn Nets @ Barclays Center, 2025-03-01 00:30 UTC",121.0,102.0
401705420,01/03/2025,Miami Heat,Indiana Pacers,Kaseya Center,01/03/2025,01:00 UTC,"Indiana Pacers vs Miami Heat @ Kaseya Center, 2025-03-01 01:00 UTC",120.0,125.0
401705421,01/03/2025,Chicago Bulls,Toronto Raptors,United Center,01/03/2025,01:00 UTC,"Toronto Raptors vs Chicago Bulls @ United Center, 2025-03-01 01:00 UTC",115.0,125.0
401705422,01/03/2025,Memphis Grizzlies,New York Knicks,FedExForum,01/03/2025,01:00 UTC,"New York Knicks vs Memphis Grizzlies @ FedExForum, 2025-03-01 01:00 UTC",114.0,113.0
401705423,01/03/2025,Phoenix Suns,New Orleans Pelicans,PHX Arena,01/03/2025,02:00 UTC,"New Orleans Pelicans vs Phoenix Suns @ PHX Arena, 2025-03-01 02:00 UTC",108.0,125.0
401705424,01/03/2025,Utah Jazz,Minnesota Timberwolves,Delta Center,01/03/2025,02:30 UTC,"Minnesota Timberwolves vs Utah Jazz @ Delta Center, 2025-03-01 02:30 UTC",116.0,117.0
401705425,01/03/2025,Los Angeles Lakers,LA Clippers,crypto.com Arena,01/03/2025,03:00 UTC,"LA Clippers vs Los Angeles Lakers @ crypto.com Arena, 2025-03-01 03:00 UTC",102.0,106.0
401705426,01/03/2025,Charlotte Hornets,Washington Wizards,Spectrum Center,01/03/2025,23:00 UTC,"Washington Wizards vs Charlotte Hornets @ Spectrum Center, 2025-03-01 23:00 UTC",113.0,100.0
401705427,02/03/2025,Detroit Pistons,Brooklyn Nets,Little Caesars Arena,02/03/2025,00:00 UTC,"Brooklyn Nets vs Detroit Pistons @ Little Caesars Arena, 2025-03-02 00:00 UTC",94.0,115.0
401705428,02/03/2025,Houston Rockets,Sacramento Kings,Toyota Center (Houston),02/03/2025,01:00 UTC,"Sacramento Kings vs Houston Rockets @ Toyota Center (Houston), 2025-03-02 01:00 UTC",113.0,103.0
401705429,02/03/2025,Memphis Grizzlies,San Antonio Spurs,FedExForum,02/03/2025,01:00 UTC,"San Antonio Spurs vs Memphis Grizzlies @ FedExForum, 2025-03-02 01:00 UTC",130.0,128.0
401705430,02/03/2025,Philadelphia 76ers,Golden State Warriors,Wells Fargo Center,02/03/2025,01:30 UTC,"Golden State Warriors vs Philadelphia 76ers @ Wells Fargo Center, 2025-03-02 01:30 UTC",119.0,126.0
401705431,02/03/2025,Dallas Mavericks,Milwaukee Bucks,American Airlines Center,02/03/2025,01:30 UTC,"Milwaukee Bucks vs Dallas Mavericks @ American Airlines Center, 2025-03-02 01:30 UTC",132.0,117.0
401705432,02/03/2025,Boston Celtics,Denver Nuggets,TD Garden,02/03/2025,18:00 UTC,"Denver Nuggets vs Boston Celtics @ TD Garden, 2025-03-02 18:00 UTC",103.0,110.0
401705433,02/03/2025,Cleveland Cavaliers,Portland Trail Blazers,Rocket Arena,02/03/2025,20:30 UTC,"Portland Trail Blazers vs Cleveland Cavaliers @ Rocket Arena, 2025-03-02 20:30 UTC",129.0,133.0
401705434,02/03/2025,Indiana Pacers,Chicago Bulls,Gainbridge Fieldhouse,02/03/2025,22:00 UTC,"Chicago Bulls vs Indiana Pacers @ Gainbridge Fieldhouse, 2025-03-02 22:00 UTC",112.0,127.0
401705435,02/03/2025,Miami Heat,New York Knicks,Kaseya Center,02/03/2025,23:00 UTC,"New York Knicks vs Miami Heat @ Kaseya Center, 2025-03-02 23:00 UTC",116.0,112.0
401705436,02/03/2025,Orlando Magic,Toronto Raptors,Kia Center,02/03/2025,23:00 UTC,"Toronto Raptors vs Orlando Magic @ Kia Center, 2025-03-02 23:00 UTC",104.0,102.0
401705437,03/03/2025,San Antonio Spurs,Oklahoma City Thunder,Frost Bank Center,03/03/2025,00:00 UTC,"Oklahoma City Thunder vs San Antonio Spurs @ Frost Bank Center, 2025-03-03 00:00 UTC",146.0,132.0
401705438,03/03/2025,Utah Jazz,New Orleans Pelicans,Delta Center,03/03/2025,01:00 UTC,"New Orleans Pelicans vs Utah Jazz @ Delta Center, 2025-03-03 01:00 UTC",128.0,121.0
401705439,03/03/2025,Phoenix Suns,Minnesota Timberwolves,PHX Arena,03/03/2025,02:30 UTC,"Minnesota Timberwolves vs Phoenix Suns @ PHX Arena, 2025-03-03 02:30 UTC",116.0,98.0
401705440,03/03/2025,Los Angeles Lakers,LA Clippers,crypto.com Arena,03/03/2025,02:30 UTC,"LA Clippers vs Los Angeles Lakers @ crypto.com Arena, 2025-03-03 02:30 UTC",102.0,108.0
401705441,04/03/2025,Charlotte Hornets,Golden State Warriors,Spectrum Center,04/03/2025,00:00 UTC,"Golden State Warriors vs Charlotte Hornets @ Spectrum Center, 2025-03-04 00:00 UTC",119.0,101.0
401705442,04/03/2025,Philadelphia 76ers,Portland Trail Blazers,Wells Fargo Center,04/03/2025,00:00 UTC,"Portland Trail Blazers vs Philadelphia 76ers @ Wells Fargo Center, 2025-03-04 00:00 UTC",119.0,102.0
401705443,04/03/2025,Miami Heat,Washington Wizards,Kaseya Center,04/03/2025,00:30 UTC,"Washington Wizards vs Miami Heat @ Kaseya Center, 2025-03-04 00:30 UTC",90.0,106.0
401705444,04/03/2025,Memphis Grizzlies,Atlanta Hawks,FedExForum,04/03/2025,01:00 UTC,"Atlanta Hawks vs Memphis Grizzlies @ FedExForum, 2025-03-04 01:00 UTC",132.0,130.0
401705445,04/03/2025,Oklahoma City Thunder,Houston Rockets,Paycom Center,04/03/2025,01:00 UTC,"Houston Rockets vs Oklahoma City Thunder @ Paycom Center, 2025-03-04 01:00 UTC",128.0,137.0
401705446,04/03/2025,Dallas Mavericks,Sacramento Kings,American Airlines Center,04/03/2025,01:30 UTC,"Sacramento Kings vs Dallas Mavericks @ American Airlines Center, 2025-03-04 01:30 UTC",122.0,98.0
401705447,04/03/2025,Utah Jazz,Detroit Pistons,Delta Center,04/03/2025,02:00 UTC,"Detroit Pistons vs Utah Jazz @ Delta Center, 2025-03-04 02:00 UTC",134.0,106.0
401705448,05/03/2025,Indiana Pacers,Houston Rockets,Gainbridge Fieldhouse,05/03/2025,00:00 UTC,"Houston Rockets vs Indiana Pacers @ Gainbridge Fieldhouse, 2025-03-05 00:00 UTC",102.0,115.0
401705449,05/03/2025,Orlando Magic,Toronto Raptors,Kia Center,05/03/2025,00:00 UTC,"Toronto Raptors vs Orlando Magic @ Kia Center, 2025-03-05 00:00 UTC",114.0,113.0
401705450,05/03/2025,Atlanta Hawks,Milwaukee Bucks,State Farm Arena,05/03/2025,00:30 UTC,"Milwaukee Bucks vs Atlanta Hawks @ State Farm Arena, 2025-03-05 00:30 UTC",127.0,121.0
401705451,05/03/2025,New York Knicks,Golden State Warriors,Madison Square Garden,05/03/2025,00:30 UTC,"Golden State Warriors vs New York Knicks @ Madison Square Garden, 2025-03-05 00:30 UTC",114.0,102.0
401705452,05/03/2025,Chicago Bulls,Cleveland Cavaliers,United Center,05/03/2025,01:00 UTC,"Cleveland Cavaliers vs Chicago Bulls @ United Center, 2025-03-05 01:00 UTC",139.0,117.0
401705453,05/03/2025,Minnesota Timberwolves,Philadelphia 76ers,Target Center,05/03/2025,01:00 UTC,"Philadelphia 76ers vs Minnesota Timberwolves @ Target Center, 2025-03-05 01:00 UTC",112.0,126.0
401705454,05/03/2025,San Antonio Spurs,Brooklyn Nets,Frost Bank Center,05/03/2025,01:30 UTC,"Brooklyn Nets vs San Antonio Spurs @ Frost Bank Center, 2025-03-05 01:30 UTC",113.0,127.0
401705455,05/03/2025,Phoenix Suns,LA Clippers,PHX Arena,05/03/2025,03:00 UTC,"LA Clippers vs Phoenix Suns @ PHX Arena, 2025-03-05 03:00 UTC",117.0,119.0
401705456,05/03/2025,Los Angeles Lakers,New Orleans Pelicans,crypto.com Arena,05/03/2025,03:30 UTC,"New Orleans Pelicans vs Los Angeles Lakers @ crypto.com Arena, 2025-03-05 03:30 UTC",115.0,136.0
401705457,06/03/2025,Boston Celtics,Portland Trail Blazers,TD Garden,06/03/2025,00:00 UTC,"Portland Trail Blazers vs Boston Celtics @ TD Garden, 2025-03-06 00:00 UTC",118.0,128.0
401705458,06/03/2025,Charlotte Hornets,Minnesota Timberwolves,Spectrum Center,06/03/2025,00:00 UTC,"Minnesota Timberwolves vs Charlotte Hornets @ Spectrum Center, 2025-03-06 00:00 UTC",125.0,110.0
401705459,06/03/2025,Cleveland Cavaliers,Miami Heat,Rocket Arena,06/03/2025,00:00 UTC,"Miami Heat vs Cleveland Cavaliers @ Rocket Arena, 2025-03-06 00:00 UTC",107.0,112.0
401705460,06/03/2025,Washington Wizards,Utah Jazz,Capital One Arena,06/03/2025,00:00 UTC,"Utah Jazz vs Washington Wizards @ Capital One Arena, 2025-03-06 00:00 UTC",122.0,125.0
401705461,06/03/2025,Memphis Grizzlies,Oklahoma City Thunder,FedExForum,06/03/2025,02:30 UTC,"Oklahoma City Thunder vs Memphis Grizzlies @ FedExForum, 2025-03-06 02:30 UTC",120.0,103.0
401705462,06/03/2025,Denver Nuggets,Sacramento Kings,Ball Arena,06/03/2025,02:00 UTC,"Sacramento Kings vs Denver Nuggets @ Ball Arena, 2025-03-06 02:00 UTC",110.0,116.0
401705463,06/03/2025,Milwaukee Bucks,Dallas Mavericks,Fiserv Forum,06/03/2025,01:00 UTC,"Dallas Mavericks vs Milwaukee Bucks @ Fiserv Forum, 2025-03-06 01:00 UTC",107.0,137.0
401705464,06/03/2025,LA Clippers,Detroit Pistons,Intuit Dome,06/03/2025,03:30 UTC,"Detroit Pistons vs LA Clippers @ Intuit Dome, 2025-03-06 03:30 UTC",115.0,123.0
401705465,07/03/2025,Atlanta Hawks,Indiana Pacers,State Farm Arena,07/03/2025,00:30 UTC,"Indiana Pacers vs Atlanta Hawks @ State Farm Arena, 2025-03-07 00:30 UTC",118.0,124.0
401705466,07/03/2025,Boston Celtics,Philadelphia 76ers,TD Garden,07/03/2025,00:30 UTC,"Philadelphia 76ers vs Boston Celtics @ TD Garden, 2025-03-07 00:30 UTC",105.0,123.0
401705467,07/03/2025,Brooklyn Nets,Golden State Warriors,Barclays Center,07/03/2025,00:30 UTC,"Golden State Warriors vs Brooklyn Nets @ Barclays Center, 2025-03-07 00:30 UTC",121.0,119.0
401705468,07/03/2025,New Orleans Pelicans,Houston Rockets,Smoothie King Center,07/03/2025,01:00 UTC,"Houston Rockets vs New Orleans Pelicans @ Smoothie King Center, 2025-03-07 01:00 UTC",109.0,97.0
401705469,07/03/2025,Los Angeles Lakers,New York Knicks,crypto.com Arena,07/03/2025,03:00 UTC,"New York Knicks vs Los Angeles Lakers @ crypto.com Arena, 2025-03-07 03:00 UTC",109.0,113.0
401705470,08/03/2025,Charlotte Hornets,Cleveland Cavaliers,Spectrum Center,08/03/2025,00:00 UTC,"Cleveland Cavaliers vs Charlotte Hornets @ Spectrum Center, 2025-03-08 00:00 UTC",118.0,117.0
401705471,08/03/2025,Toronto Raptors,Utah Jazz,Scotiabank Arena,08/03/2025,00:30 UTC,"Utah Jazz vs Toronto Raptors @ Scotiabank Arena, 2025-03-08 00:30 UTC",109.0,118.0
401705472,08/03/2025,Dallas Mavericks,Memphis Grizzlies,American Airlines Center,08/03/2025,00:30 UTC,"Memphis Grizzlies vs Dallas Mavericks @ American Airlines Center, 2025-03-08 00:30 UTC",122.0,111.0
401705473,08/03/2025,Miami Heat,Minnesota Timberwolves,Kaseya Center,08/03/2025,01:00 UTC,"Minnesota Timberwolves vs Miami Heat @ Kaseya Center, 2025-03-08 01:00 UTC",106.0,104.0
401705474,08/03/2025,Oklahoma City Thunder,Portland Trail Blazers,Paycom Center,08/03/2025,01:00 UTC,"Portland Trail Blazers vs Oklahoma City Thunder @ Paycom Center, 2025-03-08 01:00 UTC",89.0,107.0
401705475,08/03/2025,Denver Nuggets,Phoenix Suns,Ball Arena,08/03/2025,03:00 UTC,"Phoenix Suns vs Denver Nuggets @ Ball Arena, 2025-03-08 03:00 UTC",141.0,149.0
401705476,08/03/2025,Sacramento Kings,San Antonio Spurs,Golden 1 Center,08/03/2025,03:00 UTC,"San Antonio Spurs vs Sacramento Kings @ Golden 1 Center, 2025-03-08 03:00 UTC",109.0,127.0
401705477,08/03/2025,LA Clippers,New York Knicks,Intuit Dome,08/03/2025,03:30 UTC,"New York Knicks vs LA Clippers @ Intuit Dome, 2025-03-08 03:30 UTC",95.0,105.0
401705478,08/03/2025,Charlotte Hornets,Brooklyn Nets,Spectrum Center,08/03/2025,23:00 UTC,"Brooklyn Nets vs Charlotte Hornets @ Spectrum Center, 2025-03-08 23:00 UTC",102.0,105.0
401705479,09/03/2025,Houston Rockets,New Orleans Pelicans,Toyota Center (Houston),09/03/2025,00:00 UTC,"New Orleans Pelicans vs Houston Rockets @ Toyota Center (Houston), 2025-03-09 00:00 UTC",117.0,146.0
401705480,09/03/2025,Atlanta Hawks,Indiana Pacers,State Farm Arena,09/03/2025,00:30 UTC,"Indiana Pacers vs Atlanta Hawks @ State Farm Arena, 2025-03-09 00:30 UTC",118.0,120.0
401705481,09/03/2025,Toronto Raptors,Washington Wizards,Scotiabank Arena,09/03/2025,00:30 UTC,"Washington Wizards vs Toronto Raptors @ Scotiabank Arena, 2025-03-09 00:30 UTC",118.0,117.0
401705482,09/03/2025,Miami Heat,Chicago Bulls,Kaseya Center,09/03/2025,01:00 UTC,"Chicago Bulls vs Miami Heat @ Kaseya Center, 2025-03-09 01:00 UTC",114.0,109.0
401705483,09/03/2025,Milwaukee Bucks,Orlando Magic,Fiserv Forum,09/03/2025,01:00 UTC,"Orlando Magic vs Milwaukee Bucks @ Fiserv Forum, 2025-03-09 01:00 UTC",111.0,109.0
401705484,09/03/2025,Boston Celtics,Los Angeles Lakers,TD Garden,09/03/2025,01:30 UTC,"Los Angeles Lakers vs Boston Celtics @ TD Garden, 2025-03-09 01:30 UTC",101.0,111.0
401705485,09/03/2025,Golden State Warriors,Detroit Pistons,Chase Center,09/03/2025,01:30 UTC,"Detroit Pistons vs Golden State Warriors @ Chase Center, 2025-03-09 01:30 UTC",110.0,115.0
401705486,09/03/2025,Oklahoma City Thunder,Denver Nuggets,Paycom Center,09/03/2025,17:00 UTC,"Denver Nuggets vs Oklahoma City Thunder @ Paycom Center, 2025-03-09 17:00 UTC",103.0,127.0
401705487,09/03/2025,Dallas Mavericks,Phoenix Suns,American Airlines Center,09/03/2025,19:30 UTC,"Phoenix Suns vs Dallas Mavericks @ American Airlines Center, 2025-03-09 19:30 UTC",125.0,116.0
401705488,10/03/2025,Milwaukee Bucks,Cleveland Cavaliers,Fiserv Forum,10/03/2025,00:00 UTC,"Cleveland Cavaliers vs Milwaukee Bucks @ Fiserv Forum, 2025-03-10 00:00 UTC",112.0,100.0
401705489,09/03/2025,New Orleans Pelicans,Memphis Grizzlies,Smoothie King Center,09/03/2025,23:00 UTC,"Memphis Grizzlies vs New Orleans Pelicans @ Smoothie King Center, 2025-03-09 23:00 UTC",107.0,104.0
401705490,09/03/2025,Philadelphia 76ers,Utah Jazz,Wells Fargo Center,09/03/2025,23:30 UTC,"Utah Jazz vs Philadelphia 76ers @ Wells Fargo Center, 2025-03-09 23:30 UTC",122.0,126.0
401705491,10/03/2025,Minnesota Timberwolves,San Antonio Spurs,Target Center,10/03/2025,00:00 UTC,"San Antonio Spurs vs Minnesota Timberwolves @ Target Center, 2025-03-10 00:00 UTC",124.0,141.0
401705492,10/03/2025,Portland Trail Blazers,Detroit Pistons,Moda Center,10/03/2025,01:00 UTC,"Detroit Pistons vs Portland Trail Blazers @ Moda Center, 2025-03-10 01:00 UTC",119.0,112.0
401705493,10/03/2025,LA Clippers,Sacramento Kings,Intuit Dome,10/03/2025,01:30 UTC,"Sacramento Kings vs LA Clippers @ Intuit Dome, 2025-03-10 01:30 UTC",110.0,111.0
401705494,10/03/2025,Atlanta Hawks,Philadelphia 76ers,State Farm Arena,10/03/2025,23:30 UTC,"Philadelphia 76ers vs Atlanta Hawks @ State Farm Arena, 2025-03-10 23:30 UTC",123.0,132.0
401705495,10/03/2025,Boston Celtics,Utah Jazz,TD Garden,10/03/2025,23:30 UTC,"Utah Jazz vs Boston Celtics @ TD Garden, 2025-03-10 23:30 UTC",108.0,114.0
401705496,10/03/2025,Brooklyn Nets,Los Angeles Lakers,Barclays Center,10/03/2025,23:30 UTC,"Los Angeles Lakers vs Brooklyn Nets @ Barclays Center, 2025-03-10 23:30 UTC",108.0,111.0
401705497,10/03/2025,Miami Heat,Charlotte Hornets,Kaseya Center,10/03/2025,23:30 UTC,"Charlotte Hornets vs Miami Heat @ Kaseya Center, 2025-03-10 23:30 UTC",105.0,102.0
401705498,10/03/2025,Toronto Raptors,Washington Wizards,Scotiabank Arena,10/03/2025,23:30 UTC,"Washington Wizards vs Toronto Raptors @ Scotiabank Arena, 2025-03-10 23:30 UTC",104.0,119.0
401705499,11/03/2025,Chicago Bulls,Indiana Pacers,United Center,11/03/2025,00:00 UTC,"Indiana Pacers vs Chicago Bulls @ United Center, 2025-03-11 00:00 UTC",103.0,121.0
401705500,11/03/2025,Houston Rockets,Orlando Magic,Toyota Center (Houston),11/03/2025,00:00 UTC,"Orlando Magic vs Houston Rockets @ Toyota Center (Houston), 2025-03-11 00:00 UTC",84.0,97.0
401705501,11/03/2025,Memphis Grizzlies,Phoenix Suns,FedExForum,11/03/2025,00:00 UTC,"Phoenix Suns vs Memphis Grizzlies @ FedExForum, 2025-03-11 00:00 UTC",118.0,120.0
401705502,11/03/2025,Oklahoma City Thunder,Denver Nuggets,Paycom Center,11/03/2025,00:00 UTC,"Denver Nuggets vs Oklahoma City Thunder @ Paycom Center, 2025-03-11 00:00 UTC",140.0,127.0
401705503,11/03/2025,San Antonio Spurs,Dallas Mavericks,Frost Bank Center,11/03/2025,00:30 UTC,"Dallas Mavericks vs San Antonio Spurs @ Frost Bank Center, 2025-03-11 00:30 UTC",133.0,129.0
401705504,11/03/2025,Golden State Warriors,Portland Trail Blazers,Chase Center,11/03/2025,02:00 UTC,"Portland Trail Blazers vs Golden State Warriors @ Chase Center, 2025-03-11 02:00 UTC",120.0,130.0
401705505,11/03/2025,Sacramento Kings,New York Knicks,Golden 1 Center,11/03/2025,02:30 UTC,"New York Knicks vs Sacramento Kings @ Golden 1 Center, 2025-03-11 02:30 UTC",133.0,104.0
401705506,11/03/2025,Cleveland Cavaliers,Brooklyn Nets,Rocket Arena,11/03/2025,23:00 UTC,"Brooklyn Nets vs Cleveland Cavaliers @ Rocket Arena, 2025-03-11 23:00 UTC",104.0,109.0
401705507,11/03/2025,Detroit Pistons,Washington Wizards,Little Caesars Arena,11/03/2025,23:00 UTC,"Washington Wizards vs Detroit Pistons @ Little Caesars Arena, 2025-03-11 23:00 UTC",103.0,123.0
401705508,11/03/2025,Indiana Pacers,Milwaukee Bucks,Gainbridge Fieldhouse,11/03/2025,23:30 UTC,"Milwaukee Bucks vs Indiana Pacers @ Gainbridge Fieldhouse, 2025-03-11 23:30 UTC",114.0,115.0
401705509,12/03/2025,New Orleans Pelicans,LA Clippers,Smoothie King Center,12/03/2025,00:00 UTC,"LA Clippers vs New Orleans Pelicans @ Smoothie King Center, 2025-03-12 00:00 UTC",120.0,127.0
401705510,07/03/2025,Orlando Magic,Chicago Bulls,Kia Center,07/03/2025,00:00 UTC,"Chicago Bulls vs Orlando Magic @ Kia Center, 2025-03-07 00:00 UTC",125.0,123.0
401705511,12/03/2025,Atlanta Hawks,Charlotte Hornets,State Farm Arena,12/03/2025,23:30 UTC,"Charlotte Hornets vs Atlanta Hawks @ State Farm Arena, 2025-03-12 23:30 UTC",110.0,123.0
401705512,12/03/2025,Boston Celtics,Oklahoma City Thunder,TD Garden,12/03/2025,23:30 UTC,"Oklahoma City Thunder vs Boston Celtics @ TD Garden, 2025-03-12 23:30 UTC",118.0,112.0
401705513,12/03/2025,Toronto Raptors,Philadelphia 76ers,Scotiabank Arena,12/03/2025,23:30 UTC,"Philadelphia 76ers vs Toronto Raptors @ Scotiabank Arena, 2025-03-12 23:30 UTC",105.0,118.0
401705514,13/03/2025,Miami Heat,LA Clippers,Kaseya Center,13/03/2025,00:00 UTC,"LA Clippers vs Miami Heat @ Kaseya Center, 2025-03-13 00:00 UTC",119.0,104.0
401705515,13/03/2025,Houston Rockets,Phoenix Suns,Toyota Center (Houston),13/03/2025,00:00 UTC,"Phoenix Suns vs Houston Rockets @ Toyota Center (Houston), 2025-03-13 00:00 UTC",104.0,111.0
401705516,13/03/2025,Memphis Grizzlies,Utah Jazz,FedExForum,13/03/2025,00:00 UTC,"Utah Jazz vs Memphis Grizzlies @ FedExForum, 2025-03-13 00:00 UTC",115.0,122.0
401705517,13/03/2025,San Antonio Spurs,Dallas Mavericks,Frost Bank Center,13/03/2025,00:00 UTC,"Dallas Mavericks vs San Antonio Spurs @ Frost Bank Center, 2025-03-13 00:00 UTC",116.0,126.0
401705518,13/03/2025,Denver Nuggets,Minnesota Timberwolves,Ball Arena,13/03/2025,02:00 UTC,"Minnesota Timberwolves vs Denver Nuggets @ Ball Arena, 2025-03-13 02:00 UTC",115.0,95.0
401705519,13/03/2025,Portland Trail Blazers,New York Knicks,Moda Center,13/03/2025,02:00 UTC,"New York Knicks vs Portland Trail Blazers @ Moda Center, 2025-03-13 02:00 UTC",114.0,113.0
401705520,13/03/2025,Detroit Pistons,Washington Wizards,Little Caesars Arena,13/03/2025,23:00 UTC,"Washington Wizards vs Detroit Pistons @ Little Caesars Arena, 2025-03-13 23:00 UTC",129.0,125.0
401705521,13/03/2025,Milwaukee Bucks,Los Angeles Lakers,Fiserv Forum,13/03/2025,23:30 UTC,"Los Angeles Lakers vs Milwaukee Bucks @ Fiserv Forum, 2025-03-13 23:30 UTC",106.0,126.0
401705522,14/03/2025,Chicago Bulls,Brooklyn Nets,United Center,14/03/2025,00:00 UTC,"Brooklyn Nets vs Chicago Bulls @ United Center, 2025-03-14 00:00 UTC",110.0,116.0
